{
  "reasoning": "The query aims to understand user preferences regarding pets and the motivations behind those choices. Current results fail to capture this, focusing on unrelated topics.  To improve, we need to identify terms related to animals, companionship, personality traits, and reasons for liking something.",
  "query_goals": [
    "identify user's favorite pet",
    "understand reasons for preference"
  ],
  "ineffective_terms": [
    "what",
    "is",
    "your",
    "favorite",
    "why"
  ],
  "breadth_expansion": [
    "dogs",
    "cats",
    "birds",
    "fish",
    "reptiles",
    "mammals",
    "companion animals",
    "loyalty",
    "playfulness",
    "independence",
    "responsibility"
  ],
  "depth_chain": [
    "dogs",
    "breeds",
    "golden retriever",
    "labrador retriever",
    "intelligence",
    "trainability",
    "family-friendly"
  ],
  "augmented_query": "golden retriever, labrador retriever, intelligence, trainability, family-friendly",
  "ndcg": {
    "NDCG@10": 1.0,
    "NDCG@100": 1.0,
    "NDCG@1000": 1.0,
    "NDCG@10000": 1.0
  },
  "map": {
    "MAP@10": 1.0,
    "MAP@100": 1.0,
    "MAP@1000": 1.0,
    "MAP@10000": 1.0
  },
  "recall": {
    "Recall@10": 1.0,
    "Recall@100": 1.0,
    "Recall@1000": 1.0,
    "Recall@10000": 1.0
  },
  "precision": {
    "P@10": 0.1,
    "P@100": 0.01,
    "P@1000": 0.001,
    "P@10000": 0.0001
  },
  "delta": 0.0,
  "instruction": "expand",
  "query": "What is your favorite pet? Why?",
  "query_id": "12865",
  "dataset": "quoraretrieval",
  "generator_model": "ollama_chat/gemma2:9b-instruct-q8_0",
  "temperature": 1.0,
  "thought_process": "Looking at the original query, \"What is your favorite pet? Why?\"... this makes me think of the various types of pets people can have, though the user might actually be trying to understand the reasons behind preferring one pet over another. It seems like they're seeking a deeper connection or insight into pet ownership, rather than just a list of pets. I'm seeing several possibilities here... Let me approach this using the expansion technique provided, which involves being specific and diverse, applying varied augmentation techniques like synonym replacement, conceptual expansion, contextual expansion, and domain-specific terminology. This should help because it allows us to capture a wide range of relevant terms that aren't immediately apparent from the original query.\n\nFirst, I need to examine the primary objectives and gaps in the original query. The goal is to identify the user's favorite pet and understand the reasons for this preference. There's a gap in understanding the motivations and characteristics that lead to a pet being favored. Following the expansion technique, I should first identify ineffective terms that are too broad or non-precise. Terms like \"what,\" \"is,\" \"your,\" \"favorite,\" and \"why\" are not very helpful in narrowing down specific pets or reasons for preference.\n\nNext, I move on to breadth expansion, where I list candidate terms with increasingly distant concepts to the original query. We already have a list that includes dogs, cats, birds, fish, reptiles, mammals, companion animals, loyalty, playfulness, independence, and responsibility. This step of the technique is revealing a wide range of pet types and characteristics... which actually reminds me of how different pets cater to different personalities and lifestyles. \n\nFor depth expansion, I choose one distant but important topic from the breadth expansion and go deeper into related terms. Let's take \"dogs\" as an example. Going deeper, we have breeds like golden retriever and labrador retriever, which are known for their intelligence, trainability, and being family-friendly. Applying the technique's step here leads me to consider other breeds that might share similar characteristics, such as poodles or beagles, and their unique traits like low shedding or hunting instinct.\n\nI just had a realization that connects to what we were exploring earlier... the importance of lifestyle and living situation in choosing a pet. For instance, someone living in an apartment might prefer a pet that requires less space, like a cat or a bird, whereas someone with a large yard might prefer a dog that needs room to run. This realization points me toward considering terms related to pet care and ownership responsibilities, such as grooming needs, exercise requirements, and dietary considerations.\n\nThrough this process of applying the expansion technique and exploring related threads, I believe the following terms would be most effective for an augmented query: golden retriever, labrador retriever, intelligence, trainability, family-friendly, poodles, beagles, low shedding, hunting instinct, grooming needs, exercise requirements, dietary considerations. These terms capture both the explicit and implicit aspects of what the user is seeking, focusing on specific pet types, their characteristics, and the responsibilities and considerations involved in pet ownership.\n\nHowever, to refine this further and adhere to the guidelines of being specific, diverse, and ensuring no logical operators or duplication, I'll focus on the most relevant and unique terms that emerge from the depth expansion and related reflections. The terms like \"golden retriever,\" \"labrador retriever,\" \"intelligence,\" \"trainability,\" and \"family-friendly\" directly come from the depth expansion, offering a clear and targeted approach to understanding favorite pets and reasons for preference. Additional terms like \"poodles,\" \"beagles,\" and characteristics such as \"low shedding\" and \"hunting instinct\" provide a broader yet still focused spectrum of pet preferences and needs.\n\nThus, considering the need for uniqueness, diversity, and relevance, the final augmented query should include terms that not only reflect the preferred pets but also the reasons and characteristics that make them favorable, ensuring a balance between the explicit query and the implicit preferences and needs of pet owners.",
  "though_generator": "openrouter/meta-llama/llama-3.3-70b-instruct"
}