{
  "reasoning": "The query seeks specific financial data about PepsiCo Inc.'s initial public offering (IPO) price and the current value of 100 shares. The current results are irrelevant as they do not pertain to financial history or stock market information.",
  "query_goals": [
    "Find PepsiCo's IPO price",
    "Calculate the current worth of 100 PepsiCo shares"
  ],
  "ineffective_terms": [
    "what",
    "would",
    "be",
    "worth"
  ],
  "breadth_expansion": [
    "initial public offering (IPO)",
    "stock market",
    "share price",
    "financial performance",
    "market capitalization"
  ],
  "depth_chain": [
    "IPO date",
    "first-day trading volume",
    "underwriting firm",
    "investment bankers",
    "investor demand"
  ],
  "augmented_query": "\"PepsiCo IPO date underwriting firm investment bankers investor demand share price\"",
  "ndcg": {
    "NDCG@10": 1.0,
    "NDCG@100": 1.0,
    "NDCG@1000": 1.0,
    "NDCG@10000": 1.0
  },
  "map": {
    "MAP@10": 1.0,
    "MAP@100": 1.0,
    "MAP@1000": 1.0,
    "MAP@10000": 1.0
  },
  "recall": {
    "Recall@10": 1.0,
    "Recall@100": 1.0,
    "Recall@1000": 1.0,
    "Recall@10000": 1.0
  },
  "precision": {
    "P@10": 0.1,
    "P@100": 0.01,
    "P@1000": 0.001,
    "P@10000": 0.0001
  },
  "delta": 0.0,
  "instruction": "expand",
  "query": "What was PepsiCo Inc's IPO price? What would 100 shares be worth today?",
  "query_id": "296098",
  "dataset": "quoraretrieval",
  "generator_model": "ollama_chat/gemma2:9b-instruct-q8_0",
  "temperature": 1.0,
  "thought_process": "Looking at the original query, \"What was PepsiCo Inc's IPO price? What would 100 shares be worth today?\"... this makes me think of financial history and stock market analysis, though the user might actually be trying to understand the growth of their investment or the company's performance over time. Hmm, not sure yet... The existing reasoning provided is a good start, focusing on the specific financial data and the current value of shares, but it lacks depth in terms of financial analysis and market trends.\n\nI'm seeing several possibilities here... Let me approach this using the expansion technique provided, which involves being specific and diverse, applying varied augmentation techniques such as synonym replacement, conceptual expansion, contextual expansion, and domain-specific terminology. This should help because it will allow me to introduce new dimensions to the query that are both relevant and novel.\n\nStarting with Task 1, Goal Elucidation & Gaps, the primary objectives are clear: find PepsiCo's IPO price and calculate the current worth of 100 shares. However, there's a gap in understanding the broader financial context and the factors that influence stock prices over time.\n\nMoving on to Task 2, Ineffective Term Identification, terms like \"what,\" \"would,\" \"be,\" and \"worth\" are too broad and non-precise. They don't add much value to the search query and should be avoided in the augmented query.\n\nFor Task 3, Breadth Expansion, considering concepts like \"initial public offering (IPO),\" \"stock market,\" \"share price,\" \"financial performance,\" and \"market capitalization\" can help. These terms introduce new dimensions related to financial markets and company performance.\n\nTask 4, Depth Expansion, is where things get interesting. Choosing \"market capitalization\" as a distant but important topic, we can dive deeper into related terms such as \"market trends,\" \"stock exchange listings,\" \"financial reporting,\" and \"investor confidence.\" This depth provides a richer understanding of the factors influencing PepsiCo's stock price over time.\n\nApplying the technique systematically, I start by focusing on the IPO aspect, considering terms like \"IPO date,\" \"underwriting firm,\" and \"investment bankers.\" These are crucial for understanding the initial public offering context. However, my intuition also suggests looking into \"market trends\" and \"financial performance\" to get a broader view of how PepsiCo's stock has evolved.\n\nOccasionally, I reconsider my approach, thinking about how \"initial public offering\" could be too narrow, and then I expand it to include \"stock market listings\" and \"financial regulatory compliance.\" This broader view might capture more relevant information about PepsiCo's history on the stock market.\n\nA tangent that proves useful is exploring \"investor demand\" and how it affects stock prices. This leads me to think about \"market capitalization\" and how it reflects a company's size and influence in the market. It's a natural connection that enhances my understanding of what factors into the current worth of 100 shares.\n\nStepping back to reassess, I realize that combining terms from both the breadth and depth expansions could create a powerful search query. The key is to balance the specificity of terms like \"IPO underwriting firm\" with the broader financial context terms like \"market capitalization\" and \"financial performance.\"\n\nThrough this process of applying the expansion technique and exploring related threads, I believe the terms that would be most effective for a targeted search are those that combine the specificity of the IPO event with the broader financial market context. This approach ensures that the search captures both the historical data and the current market situation that influences the stock's value.\n\nSynthesizing my thoughts, the augmented query should include terms that reflect the company's financial history, its performance on the stock market, and factors influencing its stock price. By combining these elements, the search can yield results that are both relevant and diverse, providing a comprehensive view of PepsiCo's IPO price and the current worth of its shares.",
  "though_generator": "openrouter/meta-llama/llama-3.3-70b-instruct"
}