{
  "reasoning": "The query seeks specific earphone recommendations under a budget constraint, emphasizing \"truebass\" sound quality. The current results lack actionable product information, suggesting a need to refine the search by focusing on product features and specifications within the price range.",
  "query_goals": [
    "find earphones with mic",
    "truebass sound",
    "budget under Rs. 1000"
  ],
  "ineffective_terms": [
    "best"
  ],
  "breadth_expansion": [
    "wireless earphones",
    "in-ear earphones",
    "headphones",
    "audio quality",
    "microphone sensitivity",
    "noise cancellation"
  ],
  "depth_chain": [
    "bass-heavy music",
    "electronic dance music",
    "hip hop",
    "low frequency response",
    "audio driver size",
    "sound signature"
  ],
  "augmented_query": "wireless earphones, in-ear earphones, truebass, audio quality, bass-heavy music, low frequency response, microphone sensitivity",
  "ndcg": {
    "NDCG@10": 1.0,
    "NDCG@100": 1.0,
    "NDCG@1000": 1.0,
    "NDCG@10000": 1.0
  },
  "map": {
    "MAP@10": 1.0,
    "MAP@100": 1.0,
    "MAP@1000": 1.0,
    "MAP@10000": 1.0
  },
  "recall": {
    "Recall@10": 1.0,
    "Recall@100": 1.0,
    "Recall@1000": 1.0,
    "Recall@10000": 1.0
  },
  "precision": {
    "P@10": 0.1,
    "P@100": 0.01,
    "P@1000": 0.001,
    "P@10000": 0.0001
  },
  "delta": 0.0,
  "instruction": "expand",
  "query": "Which are the best earphones with mic (truebass) under Rs. 1000?",
  "query_id": "47788",
  "dataset": "quoraretrieval",
  "generator_model": "ollama_chat/gemma2:9b-instruct-q8_0",
  "temperature": 1.0,
  "thought_process": "Looking at the original query, \"Which are the best earphones with mic (truebass) under Rs. 1000?\", this makes me think of someone looking for high-quality earphones that can deliver deep bass sound, which is often associated with genres like electronic dance music or hip hop. Though the user might actually be trying to find earphones for everyday use, the emphasis on \"truebass\" suggests a specific preference for low-frequency sound quality. \n\nI'm seeing several possibilities here, but to approach this systematically, let me use the expansion technique provided, which involves being specific and diverse, applying varied augmentation techniques, and focusing on targeted expansions that introduce new dimensions to the query. This should help because it allows us to consider the query from multiple angles, including the type of earphones, sound quality aspects, and even the context in which these earphones will be used.\n\nStarting with goal elucidation, the primary objective is to find earphones that meet specific criteria: they must have a microphone, offer truebass sound, and be affordable (under Rs. 1000). The gap in the original query is the lack of specificity regarding the type of earphones (e.g., wireless, in-ear) and detailed sound quality aspects beyond \"truebass.\"\n\nFor ineffective term identification, terms like \"best\" are too broad and don't add much value to the search because they're subjective and don't specify what aspects of the earphones are prioritized.\n\nMoving to breadth expansion, we consider terms that introduce new dimensions: wireless earphones, in-ear earphones, headphones, audio quality, microphone sensitivity, and noise cancellation. These terms help expand the search space by considering different types of earphones and aspects of sound quality.\n\nFor depth expansion, choosing \"bass-heavy music\" as a starting point, we can delve deeper into related terms such as electronic dance music, hip hop, low frequency response, audio driver size, and sound signature. This step involves understanding the specific needs of users who prioritize bass sound, which can lead to more targeted search terms like \"sub-bass,\" \"bass response,\" \"driver size,\" and \"sound isolation.\"\n\nAs I apply the expansion technique, I notice that the emphasis on truebass and the association with bass-heavy music genres leads me to consider terms related to low-frequency sound reproduction. The technique's focus on specificity and diversity encourages me to explore beyond the immediate query terms, into areas like audio technology and user preferences.\n\nI just had a realization that connects to what we were exploring earlier - the importance of audio driver size and material in achieving good bass response. This is a critical aspect of earphone design that directly impacts the sound quality, particularly for users seeking deep bass.\n\nFollowing the technique pointed me toward terms like \"low frequency response\" and \"audio driver size,\" but my instinct says we should also consider \"impedance\" and \"frequency range\" as these are crucial for understanding how well earphones can reproduce bass sounds.\n\nThrough this process of applying the expansion technique and exploring related threads, I believe the terms that would be most effective for a targeted search are those that capture the essence of truebass sound quality, the importance of microphone sensitivity for clear calls, and the specific audio preferences of users. This leads to a refined understanding of what the user might be looking for beyond the original query terms.\n\nThe final terms I've selected are: wireless earphones, in-ear earphones, truebass, audio quality, bass-heavy music, low frequency response, microphone sensitivity, sub-bass, bass response, driver size, sound signature, sound isolation, impedance, frequency range.",
  "though_generator": "openrouter/meta-llama/llama-3.3-70b-instruct"
}