{
  "reasoning": "The query aims to understand the prerequisites and necessary components for conducting genetic studies. It lacks specificity regarding the type of genetic study (e.g., population genetics, clinical genetics).",
  "query_goals": [
    "identify essential requirements",
    "understand research methods",
    "explore ethical considerations"
  ],
  "ineffective_terms": [
    "requirements",
    "studies"
  ],
  "breadth_expansion": [
    "DNA sequencing",
    "bioinformatics",
    "genetic testing",
    "pedigree analysis",
    "gene editing",
    "genomics",
    "population genetics",
    "ethical guidelines",
    "research design"
  ],
  "depth_chain": [
    "ethical guidelines",
    "informed consent",
    "patient privacy",
    "data security",
    "IRB approval",
    "risk-benefit analysis",
    "confidentiality",
    "genetic discrimination"
  ],
  "augmented_query": "DNA sequencing, bioinformatics, genetic testing, gene editing, ethical guidelines, informed consent, patient privacy",
  "ndcg": {
    "NDCG@10": 1.0,
    "NDCG@100": 1.0,
    "NDCG@1000": 1.0,
    "NDCG@10000": 1.0
  },
  "map": {
    "MAP@10": 1.0,
    "MAP@100": 1.0,
    "MAP@1000": 1.0,
    "MAP@10000": 1.0
  },
  "recall": {
    "Recall@10": 1.0,
    "Recall@100": 1.0,
    "Recall@1000": 1.0,
    "Recall@10000": 1.0
  },
  "precision": {
    "P@10": 0.1,
    "P@100": 0.01,
    "P@1000": 0.001,
    "P@10000": 0.0001
  },
  "delta": 0.0,
  "instruction": "expand",
  "query": "What are the requirements needed for genetic studies?",
  "query_id": "501182",
  "dataset": "quoraretrieval",
  "generator_model": "ollama_chat/gemma2:9b-instruct-q8_0",
  "temperature": 1.0,
  "thought_process": "Looking at the original query, \"What are the requirements needed for genetic studies?\" this makes me think of the numerous aspects involved in conducting such studies, from the technical requirements like DNA sequencing and bioinformatics, to the ethical considerations that must be taken into account. Though the user might actually be trying to understand the prerequisites for a specific type of genetic study, such as clinical or population genetics, the query lacks this specificity. My initial impression is that we need to broaden the scope while also diving deeper into specific areas to provide a comprehensive answer.\n\nI'm seeing several possibilities here, but to structure my approach, I'll use the expansion technique that involves synonym replacement, conceptual expansion, contextual expansion, and domain-specific terminology. This should help because it allows me to systematically explore related concepts and terms that are both directly and indirectly relevant to the original query.\n\nFirst, let's consider the primary objectives and gaps in the original query. The goal is to identify essential requirements and understand research methods, but it's unclear what type of genetic study is being referred to. This lack of specificity is a gap that needs to be addressed. Task 1, goal elucidation, and gap analysis reveal that we need to focus on making the query more specific and diverse.\n\n Moving on to Task 2, ineffective term identification, terms like \"requirements\" and \"studies\" are too broad and non-precise. They should be avoided in the augmented query because they don't add much value in terms of specificity.\n\nFor Task 3, breadth expansion, we introduce terms that are increasingly distant but still relevant to the original query. Terms like DNA sequencing, bioinformatics, genetic testing, pedigree analysis, gene editing, genomics, population genetics, ethical guidelines, and research design start to paint a more comprehensive picture. However, we need to ensure these terms are novel and don't overlap with the original query's intent.\n\nNow, for Task 4, depth expansion, let's choose one of these distant but important topics, such as \"ethical guidelines,\" and dive deeper. This involves exploring related terms like informed consent, patient privacy, data security, IRB approval, risk-benefit analysis, confidentiality, and genetic discrimination. This step is crucial because it provides the depth needed to understand the nuances of conducting genetic studies, especially from an ethical standpoint.\n\nAs I apply the expansion technique, I notice that terms from the depth expansion, such as ethical guidelines, informed consent, and patient privacy, are not only relevant but also targeted and precise. They complement the broader terms from the breadth expansion, like DNA sequencing and genomics, by adding a layer of specificity that was lacking in the original query.\n\nI just had a realization that connects to what we were exploring earlier - the importance of balancing the technical aspects of genetic studies with the ethical considerations. This balance is crucial for ensuring that research is not only scientifically sound but also respects the rights and privacy of participants.\n\nFollowing the technique pointed me toward terms like gene editing and genomics, but my instinct says we should also consider the implications of these technologies on society and individuals. This is where terms like genetic discrimination and confidentiality become essential.\n\nThrough this process of applying the expansion technique and exploring related threads, I believe the terms that would be most effective for an augmented query are those that capture both the explicit and implicit aspects of what the user is seeking. The final augmented query should reflect a balance between technical requirements, research methods, and ethical considerations, ensuring that it's novel, diverse, and relevant.",
  "though_generator": "openrouter/meta-llama/llama-3.3-70b-instruct"
}