{
  "reasoning": "This query focuses on agricultural productivity in the U.S., examining its growth from 1948 to 2013. The provided document types suggest a multi-faceted understanding of this topic, encompassing economic principles, human resource management, and historical analysis.  \n\nTo create a conceptual map, we'll establish the central point as \"U.S. Agricultural Productivity.\" From there, we can explore its relationship to factors like technology, labor, government policies, and market forces.",
  "central_coordinates": [
    "U.S. Agricultural Productivity",
    "1948-2013 Growth"
  ],
  "boundary_areas": [
    "Economic Growth",
    "Agricultural Policy",
    "Technological Innovation",
    "Labor Markets",
    "Food Security"
  ],
  "key_landmarks": [
    "Green Revolution",
    "Farm Bill",
    "Land-Grant Universities",
    "Precision Agriculture",
    "USDA"
  ],
  "detail_features": [
    "Mechanization",
    "Irrigation",
    "Fertilizer Use",
    "Crop Yield Data",
    "Rural Employment Trends",
    "Agricultural Subsidies",
    "Trade Agreements",
    "Climate Change Impacts"
  ],
  "navigation_terms": [
    "Productivity",
    "Output",
    "Yield",
    "Efficiency",
    "Input",
    "Labor Force",
    "Policy",
    "Innovation",
    "Sustainability",
    "Market",
    "Demand"
  ],
  "augmented_query": "\"U.S. agricultural productivity growth trends 1948-2013, including the role of technology, labor markets, and government policy.\"",
  "ndcg": {
    "NDCG@10": 0.14127,
    "NDCG@100": 0.21429,
    "NDCG@1000": 0.21429,
    "NDCG@10000": 0.26013
  },
  "map": {
    "MAP@10": 0.03704,
    "MAP@100": 0.04488,
    "MAP@1000": 0.04488,
    "MAP@10000": 0.04571
  },
  "recall": {
    "Recall@10": 0.33333,
    "Recall@100": 0.66667,
    "Recall@1000": 0.66667,
    "Recall@10000": 1.0
  },
  "precision": {
    "P@10": 0.1,
    "P@100": 0.02,
    "P@1000": 0.002,
    "P@10000": 0.0003
  },
  "delta": 0.02148999999999998,
  "instruction": "cartography",
  "query": "\u201cIn 2013 the level of U.S. farm output was about 2.7 times its 1948 level, and productivity was growing at an average annual rate of 1.52%.",
  "query_id": "1157",
  "dataset": "climatefever",
  "generator_model": "ollama_chat/gemma2:9b-instruct-q8_0",
  "temperature": 1.0,
  "thought_process": "Looking at the query \"In 2013 the level of U.S. farm output was about 2.7 times its 1948 level, and productivity was growing at an average annual rate of 1.52%,\" this makes me think of the significant advancements in agricultural practices and technologies over the years. Though the user might actually be trying to understand the factors contributing to this growth, I'm not sure yet what specific aspects they're interested in. It seems like they're looking for a comprehensive overview of U.S. agricultural productivity from 1948 to 2013, including the role of various factors such as technology, labor markets, and government policies.\n\nI'm seeing several possibilities here, but to approach this systematically, let me use the Conceptual Territory Mapping technique, which involves creating a detailed map of the knowledge landscape surrounding the topic. This should help because it allows for a structured yet flexible exploration of the query's conceptual territory.\n\nStarting with the central coordinates, the exact center point of the query seems to be \"U.S. Agricultural Productivity\" from 1948 to 2013. Establishing the cardinal directions, I consider practical versus theoretical aspects, as well as technical versus social dimensions. The scale for exploration appears to be moderate, aiming for a balance between granular details and broad trends.\n\nMoving on to boundary exploration, the immediate territory of the query includes economic growth, agricultural policy, technological innovation, labor markets, and food security. Neighboring domains and disciplines that come into play are economics, sociology, environmental science, and political science. Noting areas where these territories overlap or connect, I see significant intersections between technological innovation and economic growth, as well as between labor markets and agricultural policy.\n\nPlotting major landmarks within this territory, key concepts include the Green Revolution, Farm Bills, Land-Grant Universities, Precision Agriculture, and the USDA. Communities of practice and schools of thought involve agricultural scientists, economists, policy makers, and farmers. Methodologies and processes include research and development, policy analysis, and farming practices.\n\nFilling in specialized features within each region, I consider mechanization, irrigation, fertilizer use, crop yield data, rural employment trends, agricultural subsidies, trade agreements, and climate change impacts. Labeling with precise terminology, these features are categorized by region and significance. Historical sites include the enactment of significant Farm Bills and the emergence of the Green Revolution, while emerging developments involve precision agriculture and the impact of climate change.\n\nConsidering the cartographic legend, a lexicon of the most important terms includes productivity, output, yield, efficiency, input, labor force, policy, innovation, sustainability, market, and demand. These terms are classified by region and significance, providing a basis for navigation within this knowledge landscape.\n\nThrough this process of applying Conceptual Territory Mapping and exploring related threads, I believe the navigation terms extracted from our map\u2014such as productivity, technology, labor markets, government policy, sustainability, and innovation\u2014would be most effective for understanding the query. They capture both the explicit and implicit aspects of what the user is seeking, providing a comprehensive framework for exploring U.S. agricultural productivity growth trends from 1948 to 2013.",
  "though_generator": "openrouter/meta-llama/llama-3.3-70b-instruct"
}