{
  "reasoning": "The query seeks specific details about Wilfred Mott's involvement with the Tenth Doctor in 'The End of Time.' The existing results focus on general episode and character information. To improve results, we need to target terms related to recruitment, specific events within the episode, and their relationship.",
  "query_goals": [
    "Identify Wilfred Mott's motivations for assisting the Doctor",
    "Determine the circumstances surrounding his recruitment",
    "Analyze the nature of their partnership in 'The End of Time'"
  ],
  "ineffective_terms": [
    "Doctor",
    "Wilfred Mott",
    "assist",
    "throughout"
  ],
  "breadth_expansion": [
    "companion",
    "crisis",
    "regenerations",
    "Time Lord",
    "future",
    "conspiracy",
    "interference"
  ],
  "depth_chain": [
    "conspiracy",
    "shadowy organization",
    "secret agendas",
    "government involvement",
    "alien threat"
  ],
  "augmented_query": "crisis companion conspiracy shadow government alien threat",
  "ndcg": {
    "NDCG@10": 1.0,
    "NDCG@100": 1.0,
    "NDCG@1000": 1.0,
    "NDCG@10000": 1.0
  },
  "map": {
    "MAP@10": 1.0,
    "MAP@100": 1.0,
    "MAP@1000": 1.0,
    "MAP@10000": 1.0
  },
  "recall": {
    "Recall@10": 1.0,
    "Recall@100": 1.0,
    "Recall@1000": 1.0,
    "Recall@10000": 1.0
  },
  "precision": {
    "P@10": 0.1,
    "P@100": 0.01,
    "P@1000": 0.001,
    "P@10000": 0.0001
  },
  "delta": 0.0,
  "instruction": "expand",
  "query": "The Tenth Doctor recruits Wilfred Mott to assist him throughout The End of Time.",
  "query_id": "71911",
  "generator_model": "ollama_chat/gemma2:9b-instruct-q8_0",
  "temperature": 1.0,
  "dataset": "fever",
  "cleaned_augmented_query": "crisis companion conspiracy shadow government alien threat",
  "final_delta": 0.0,
  "initial_results": "### Text snippet from document at k=1\n: The Tenth Doctor is an incarnation of the Doctor , the protagonist of the BBC science fiction television programme Doctor Who , who is played by David Tennant in three series as well as nine specials . As with previous incarnations of the Doctor , the character has also appeared in other Doctor Who spin-offs . In the programme 's narrative , the Doctor is a centuries-old Time Lord alien from the planet Gallifrey who travels in time in his TARDIS , frequently with companions . When the Doctor is critically injured beyond medical repair , he can regenerate his body ; in doing so , his physical appearance and personality change , and a new actor assumes the role . Tennant 's portrayal of the Doctor is of an outwardly charismatic and charming adventurer whose likable and easygoing attitude can quickly turn to righteous fury when provoked .   This incarnation 's companions include working class shop assistant Rose Tyler ( Billie Piper ) , medical student Martha Jones ( Freema Agyeman ) , and fiery temp worker Donna Noble ( Catherine Tate ) . He eventually parts ways with them all by the end of the 2008 series finale , `` Journey 's End '' , after which he attempts to travel alone for the duration of the 2008 -- 2010 specials before being accompanied by Donna Noble 's grandfather Wilfred Mott on his final adventure in The End of Time .   In November 2013 , Tennant 's Doctor was voted `` The UK 's favourite Doctor '' in a survey held by the Radio Times magazine .\n\n### Text snippet from document at k=2\n: The Sixth Doctor : The Last Adventure is a British audio drama based on the long-running British science fiction television series Doctor Who .   Within the narrative of the series , the Doctor , its principal character , is a time-travelling alien known as a Time Lord , whose biological characteristics allow him to regenerate into a new form to circumvent an otherwise deadly experience ; the device has been used to allow for a change in lead actor every few years in the production of the televised series . ...\n\n### Text snippet from document at k=10\n: Doctor Who is a British science-fiction television programme produced by the BBC since 1963 . The programme depicts the adventures of a Time Lord called `` The Doctor '' , an extraterrestrial being from the planet Gallifrey . He explores the universe in a time-travelling space ship called the TARDIS . Its exterior appears as a blue British police box , which was a common sight in Britain in 1963 when the series first aired . Accompanied by a number of companions , the Doctor combats a variety of foes , while working to save civilisations and help people in need .   The show is a significant part of British popular culture , and elsewhere it has gained a cult following . It has influenced generations of British television professionals , many of whom grew up watching the series . The programme originally ran from 1963 to 1989 . There was an unsuccessful attempt to revive regular production in 1996 with a backdoor pilot , in the form of a television film titled Doctor Who . ...\n",
  "thought_process": "Looking at the query \"The Tenth Doctor recruits Wilfred Mott to assist him throughout The End of Time,\" my initial impression is that this query seeks specific details about Wilfred Mott's involvement with the Tenth Doctor in the episode \"The End of Time.\" The original retrieval results, however, focus more on general episode and character information, suggesting we need to refine our query to capture more targeted information about their relationship and the circumstances of Wilfred's recruitment.\n\nAnalyzing the original query and its results, I notice that terms like \"Doctor,\" \"Wilfred Mott,\" \"assist,\" and \"throughout\" are quite broad and do not effectively narrow down the search to the specific events or dynamics within \"The End of Time.\" These terms are not only ineffective but also lead to a wide array of irrelevant results, necessitating a more precise approach to query expansion.\n\nTo enhance this query, I'll apply a structured approach using the expansion technique provided, which emphasizes being specific, diverse, and applying varied augmentation techniques such as synonym replacement, conceptual expansion, contextual expansion, and domain-specific terminology. The goal is to discover new, relevant documents that do not overlap with the original query terms.\n\nFirst, let's elucidate the query's primary objectives and gaps (Task 1). The query aims to understand Wilfred Mott's role and his recruitment by the Tenth Doctor in \"The End of Time,\" but it lacks specificity regarding the circumstances and the nature of their partnership. A gap exists in understanding the motivations and events leading to Wilfred's involvement.\n\nNext, identifying ineffective terms (Task 2) is crucial. Terms like \"assist\" and \"throughout\" are too vague and do not contribute significantly to narrowing down the results to the specific context of Wilfred Mott's recruitment and his role in \"The End of Time.\"\n\nFor breadth expansion (Task 3), we consider terms that introduce new dimensions to the query while maintaining relevance. Terms such as \"companion,\" \"crisis,\" \"regenerations,\" \"Time Lord,\" \"future,\" \"conspiracy,\" and \"interference\" offer a broader context that can encompass the nuances of the Doctor's interactions with Wilfred Mott and the plot of \"The End of Time.\"\n\nDelving deeper into one of these concepts for depth expansion (Task 4), let's consider \"conspiracy.\" This term has potential for revealing more about the plot and Wilfred's involvement. Further depth into \"conspiracy\" could involve terms like \"shadowy organization,\" \"secret agendas,\" \"government involvement,\" and \"alien threat,\" which could uncover specific storylines or motivations within \"The End of Time\" that are relevant to Wilfred Mott's character and his collaboration with the Doctor.\n\nApplying the expansion technique systematically while allowing for natural cognitive elements like reconsiderations and intuitive leaps is essential. For instance, recognizing the importance of \"conspiracy\" in science fiction narratives, especially in a series like Doctor Who, can lead to exploring themes of secrecy, power struggles, and external threats, all of which could be pivotal in understanding Wilfred's recruitment and his adventures with the Tenth Doctor.\n\nThe process involves moments of stepping back to reassess the direction of the query expansion. It's crucial to ensure that the expanded terms, while diverse and targeted, remain relevant to the original query's objectives. The technique should complement natural insights, allowing for a balanced approach that leverages both structured methodology and intuitive connections.\n\nThrough this process, insights emerge from both the structured approach and natural thought patterns. Applying the technique leads to the discovery of specific terms like \"crisis companion\" and \"conspiracy,\" which, when combined with terms from the depth expansion like \"shadow government\" and \"alien threat,\" form a cohesive and targeted query. This query not only captures the essence of Wilfred Mott's involvement with the Tenth Doctor but also delves into the broader themes and plot elements of \"The End of Time.\"\n\nSynthesizing these elements with clarity, the augmented query \"crisis companion conspiracy shadow government alien threat\" emerges as a refined and targeted search query. This query balances specificity with diversity, ensuring that the search results will be more relevant to the user's original objectives, providing insights into Wilfred Mott's recruitment, his role as a companion, and the conspiratorial elements of \"The End of Time.\"\n\nThe final terms in the augmented query logically emerge from both the technique and natural insights, demonstrating how structure and intuition can complement each other in the query expansion process. This approach not only enhances the search query but also reflects how experts think\u2014using structured approaches but enhancing them with intuition, experience, and creative connections.",
  "thought_generator": "openrouter/meta-llama/llama-3.3-70b-instruct"
}