{
  "reasoning": "The query focuses on the tax implications related to the timing of stock sales/repurchases. The initial results are shallow and omit key concepts like the wash sale rule. A broader search is needed, taking into account tax regulations, investment strategies, and the timing of transactions. The conceptual map should explore tax implications, strategies for tax minimization (legally), and potential pitfalls like the wash sale rule. International differences in tax laws should be considered, though are not specifically requested by this prompt.",
  "central_coordinates": [
    "Capital Gains Tax",
    "Stock Sales",
    "Repurchase",
    "Taxable Event",
    "Investment Strategy"
  ],
  "boundary_areas": [
    "Tax Law (US, International)",
    "Investment Vehicles (Stocks, Bonds, ETFs)",
    "Financial Planning",
    "Retirement Planning",
    "Estate Planning"
  ],
  "key_landmarks": [
    "Capital Gains Rate (Short-Term vs. Long-Term)",
    "Wash Sale Rule",
    "Tax-Loss Harvesting",
    "Holding Period",
    "Cost Basis",
    "IRS (or equivalent international tax authority) regulations",
    "1031 Exchange (as a potential analogy or contrast, though not directly applicable to stocks)"
  ],
  "detail_features": [
    "Qualified Dividends Tax Rate",
    "State vs. Federal Tax Implications",
    "Specific identification method",
    "First In, First Out (FIFO) Method",
    "Average Cost Basis Method",
    "Tax Form 1099-B",
    "Constructive Sale",
    "Substantially Identical Securities",
    "Controlled Foreign Corporation (CFC) implications",
    "Foreign Account Tax Compliance Act (FATCA) implications"
  ],
  "navigation_terms": [
    "Capital Gains",
    "Wash Sale",
    "Tax-Loss Harvesting",
    "Holding Period",
    "Cost Basis",
    "Substantially Identical",
    "Short-Term Capital Gain",
    "Long-Term Capital Gain",
    "1099-B",
    "Tax Bracket"
  ],
  "augmented_query": "\"Capital Gains Tax Wash Sale Rule Tax-Loss Harvesting Stock Repurchase Tax Implications\"",
  "ndcg": {
    "NDCG@10": 0.0,
    "NDCG@100": 0.15818,
    "NDCG@1000": 0.15818,
    "NDCG@10000": 0.15818
  },
  "map": {
    "MAP@10": 0.0,
    "MAP@100": 0.01266,
    "MAP@1000": 0.01266,
    "MAP@10000": 0.01266
  },
  "recall": {
    "Recall@10": 0.0,
    "Recall@100": 1.0,
    "Recall@1000": 1.0,
    "Recall@10000": 1.0
  },
  "precision": {
    "P@10": 0.0,
    "P@100": 0.01,
    "P@1000": 0.001,
    "P@10000": 0.0001
  },
  "delta": 0.029669999999999974,
  "instruction": "cartography",
  "query": "Selling high, pay capital gains, re-purchase later",
  "query_id": "6896",
  "dataset": "fiqa2018",
  "generator_model": "openrouter/google/gemini-2.0-flash-001",
  "temperature": 1.0,
  "thought_process": "As I begin to consider the query \"Selling high, pay capital gains, re-purchase later,\" my initial thoughts revolve around the tax implications of such a financial strategy. It seems the user is looking to understand how to navigate the complex world of capital gains taxes, particularly when it comes to selling stocks at a high point, paying the resultant taxes, and then repurchasing those stocks later. This immediately brings to mind concepts like the wash sale rule, which prevents investors from claiming losses on stocks they sell and then quickly buy back, essentially disallowing the deduction of losses from sales of securities if the investor purchases substantially identical securities within a short period (usually 30 days) before or after the sale.\n\nTo expand this query effectively, I will employ the technique of Conceptual Territory Mapping. This approach involves creating a detailed map of the conceptual territory surrounding the topic, including central coordinates, boundary areas, key landmarks, detail features, and navigation terms. By using this structured method, I aim to systematically uncover the breadth of relevant concepts and terminology related to the query, ensuring that no crucial aspect of capital gains taxes, stock repurchase strategies, and tax implications is overlooked.\n\nStarting with the central coordinates, I have identified \"Capital Gains Tax,\" \"Stock Sales,\" \"Repurchase,\" \"Taxable Event,\" and \"Investment Strategy\" as the core concepts. These are the foundation upon which the rest of the map will be built. Expanding outward, the boundary areas include \"Tax Law (US, International),\" \"Investment Vehicles,\" \"Financial Planning,\" \"Retirement Planning,\" and \"Estate Planning,\" all of which can have significant impacts on how one approaches the strategy of selling high and repurchasing later.\n\nPlotting key landmarks on the map involves identifying crucial concepts such as the \"Capital Gains Rate (Short-Term vs. Long-Term),\" the \"Wash Sale Rule,\" \"Tax-Loss Harvesting,\" and \"Holding Period.\" These landmarks guide the investor through the complexities of tax law and investment strategies. Further detail is added by considering \"Qualified Dividends Tax Rate,\" \"State vs. Federal Tax Implications,\" and methods for calculating cost basis such as the \"Specific Identification Method,\" \"First In, First Out (FIFO) Method,\" and \"Average Cost Basis Method.\"\n\nAs I delve deeper into the conceptual territory, I find myself navigating through areas that were initially not as apparent, such as the implications of \"Constructive Sale,\" \"Substantially Identical Securities,\" and the regulatory aspects covered by the \"IRS (or equivalent international tax authority) regulations.\" The mention of a \"1031 Exchange,\" although more commonly associated with real estate, serves as a useful point of comparison for understanding tax-deferred exchanges in other investment vehicles.\n\nThroughout this process, I've also considered the natural thought patterns and cognitive elements that complement the structured approach of Conceptual Territory Mapping. There have been moments of reconsideration, such as recognizing the importance of distinguishing between short-term and long-term capital gains, and intuitive leaps, like connecting the concept of wash sale rules to the overall strategy of tax-loss harvesting. Brief tangents, such as exploring the implications of FATCA for international investments, have provided unexpected insights into the global aspects of tax planning.\n\nThe systematic application of Conceptual Territory Mapping has allowed me to balance the structured steps of the technique with natural cognitive patterns. By applying the technique's steps, such as identifying central coordinates and boundary areas, I've been able to systematically uncover relevant concepts and terminology. At the same time, I've allowed for natural thought elements, such as reconsiderations and intuitive connections, to enhance and complement the structured approach.\n\nThrough this detailed mapping, insights have emerged from both the structured technique and my natural thought patterns. For instance, applying the technique led to the discovery of key terms like \"Wash Sale Rule\" and \"Tax-Loss Harvesting,\" which are crucial for understanding the tax implications of selling and repurchasing stocks. Additionally, my natural thought patterns have helped to identify connections between concepts, such as the relationship between holding periods and capital gains rates.\n\nSynthesizing these insights, I believe the most effective terms for navigating the knowledge landscape related to this query are \"Capital Gains,\" \"Wash Sale,\" \"Tax-Loss Harvesting,\" \"Holding Period,\" \"Cost Basis,\" \"Substantially Identical,\" \"Short-Term Capital Gain,\" \"Long-Term Capital Gain,\" \"1099-B,\" and \"Tax Bracket.\" These terms capture the essence of the tax implications, strategies, and regulatory aspects involved in selling high, paying capital gains, and repurchasing stocks later. They provide a comprehensive foundation for understanding the complex interplay of financial and tax planning strategies that investors must consider.\n\nThe final step in this process involves synthesizing the insights gained from both the structured technique and natural thought patterns. By considering the systematic application of Concept",
  "though_generator": "openrouter/meta-llama/llama-3.3-70b-instruct"
}