{
  "reasoning": "The query aims to find the average cost of a portfolio on a trading site. The existing results discuss cost factors in trading and investing but don't directly answer the question. To address this, I will create a conceptual map focusing on the components that contribute to the cost of a portfolio, the different types of fees involved, and related concepts like portfolio size and trading frequency. This will allow me to identify key navigation terms and expand the query to retrieve more relevant information.",
  "central_coordinates": [
    "Portfolio Cost",
    "Direct Costs/Indirect Costs",
    "Trading Fees/Management Fees",
    "Small Portfolio/Large Portfolio"
  ],
  "boundary_areas": [
    "Trading Psychology",
    "Tax Implications",
    "Financial Planning",
    "Risk Management",
    "Investment Strategies"
  ],
  "key_landmarks": [
    "Commission Fees",
    "Management Fees",
    "Transaction Costs",
    "Expense Ratios",
    "Advisory Fees",
    "Platform Fees",
    "Minimum Balance Requirements",
    "Bid-Ask Spread"
  ],
  "detail_features": [
    "Commission-free trading platforms",
    "Tiered fee structures",
    "AUM-based fees",
    "Performance-based fees",
    "Inactivity fees",
    "Fund expense ratios (e.g., ETFs, mutual funds)",
    "Spread costs for different asset classes, such as equities, options, or cryptocurrencies",
    "Cost of research and data subscriptions"
  ],
  "navigation_terms": [
    "Commission",
    "Management Fee",
    "Expense Ratio",
    "AUM",
    "Trading Platform",
    "Minimum Investment",
    "Bid-Ask Spread",
    "Transaction Cost",
    "Advisory Fee",
    "Platform Fee"
  ],
  "augmented_query": "\"Portfolio cost breakdown trading platform fees\"",
  "ndcg": {
    "NDCG@10": 0.0,
    "NDCG@100": 0.19196,
    "NDCG@1000": 0.19196,
    "NDCG@10000": 0.19196
  },
  "map": {
    "MAP@10": 0.0,
    "MAP@100": 0.02778,
    "MAP@1000": 0.02778,
    "MAP@10000": 0.02778
  },
  "recall": {
    "Recall@10": 0.0,
    "Recall@100": 1.0,
    "Recall@1000": 1.0,
    "Recall@10000": 1.0
  },
  "precision": {
    "P@10": 0.0,
    "P@100": 0.01,
    "P@1000": 0.001,
    "P@10000": 0.0001
  },
  "delta": 0.04718,
  "instruction": "cartography",
  "query": "What is the average cost of a portfolio on a trading site?",
  "query_id": "8034",
  "dataset": "fiqa2018",
  "generator_model": "openrouter/google/gemini-2.0-flash-001",
  "temperature": 1.0,
  "thought_process": "Looking at the query \"What is the average cost of a portfolio on a trading site?\"... this makes me think of all the various fees and charges associated with trading and managing a portfolio, though the user might actually be trying to understand the overall expense of maintaining a portfolio on a trading platform. Hmm, not sure yet... I need to break it down.\n\nI'm seeing several possibilities here... Let me approach this using the Query Expansion via Conceptual Territory Mapping technique, which involves creating a detailed map of the conceptual territory surrounding the topic. This should help because it will allow me to visually organize and connect the different components and concepts related to portfolio costs on trading sites.\n\nStarting with the central coordinates, I identify \"Portfolio Cost\" as the core concept. The direct and indirect costs, including trading fees and management fees, are crucial. I also consider the scale of the portfolio, whether it's a small or large portfolio, as this can significantly affect the costs.\n\nAs I explore the boundaries of this query, I notice areas like trading psychology, tax implications, financial planning, risk management, and investment strategies are all relevant but slightly tangential. These areas can influence portfolio costs but are not directly about the costs themselves.\n\nNow, plotting the landmarks, I have commission fees, management fees, transaction costs, expense ratios, advisory fees, platform fees, minimum balance requirements, and the bid-ask spread. These are key concepts that directly impact the cost of a portfolio.\n\nIn detail mapping, I delve into features like commission-free trading platforms, tiered fee structures, AUM-based fees, performance-based fees, inactivity fees, fund expense ratios for ETFs and mutual funds, spread costs for different asset classes, and the cost of research and data subscriptions. Each of these can significantly affect the total cost of maintaining a portfolio.\n\nCreating a cartographic legend, or a lexicon of important terms, I focus on terms like commission, management fee, expense ratio, AUM, trading platform, minimum investment, bid-ask spread, transaction cost, advisory fee, and platform fee. These terms are essential for navigating the landscape of portfolio costs on trading sites.\n\nFollowing the Query Expansion via Conceptual Territory Mapping approach, I adjust my path as I realize the importance of distinguishing between direct and indirect costs, and how different types of fees can apply to various portfolio sizes and trading frequencies. This step of the technique is revealing the complexity of portfolio costs... which actually reminds me of the importance of considering the trader's or investor's goals and risk tolerance in determining the appropriate portfolio composition and, by extension, its costs.\n\nI need to consider the next step in the technique, which involves integrating these concepts into a coherent query that can yield relevant information. However, I'm also noticing this interesting pattern where the cost structure of a portfolio can significantly influence investment decisions, potentially leading to a feedback loop between cost management and investment strategy.\n\nApplying the specific aspect of the technique that involves identifying key landmarks leads me to the discovery of terms like \"portfolio cost breakdown\" and \"trading platform fees,\" which seem central to addressing the user's query directly.\n\nI just had a realization that connects to what we were exploring earlier... the average cost of a portfolio isn't just about adding up all the fees but also about understanding how these fees interact with the portfolio's performance and the investor's objectives. Following the technique pointed me toward focusing on the explicit costs, but my instinct says we should also consider the implicit costs, like the cost of time spent managing the portfolio or the potential lost opportunity costs of certain investment decisions.\n\nThrough this process of applying the Query Expansion via Conceptual Territory Mapping technique and exploring related threads, I believe terms like \"portfolio cost,\" \"trading fees,\" \"management fees,\" \"expense ratio,\" and \"platform fees\" would be most effective for navigating the query. They capture both the explicit and implicit aspects of what the user is seeking, which is a comprehensive understanding of the average cost of maintaining a portfolio on a trading site.\n\nGiven this thought process, the expanded query that aims to capture the essence of the user's question while incorporating the insights gained from the conceptual mapping exercise would be: \"Portfolio cost breakdown trading platform fees.\" This query is designed to retrieve information that directly addresses the various components of portfolio costs, especially in the context of trading platforms and their associated fees.",
  "though_generator": "openrouter/meta-llama/llama-3.3-70b-instruct"
}