{
  "reasoning": "The query aims to find the title of a memoir written by Katharine Graham, specifically related to her experience as the honoree at Truman Capote's Black and White Ball.  The current results are too broad, including irrelevant information about other books and music.",
  "query_goals": [
    "find memoir",
    "Katharine Graham",
    "Black and White Ball",
    "Truman Capote"
  ],
  "ineffective_terms": [
    "the",
    "title of",
    "written by"
  ],
  "breadth_expansion": [
    "biography",
    "memoirs about society events",
    "journalism history",
    "Washington D.C.",
    "1960s New York City"
  ],
  "depth_chain": [
    "politics",
    "Washington Post",
    "news publishing",
    "media mogul",
    "female leadership"
  ],
  "augmented_query": "biography Washington Post journalism Katharine Graham female leadership",
  "ndcg": {
    "NDCG@10": 1.0,
    "NDCG@100": 1.0,
    "NDCG@1000": 1.0,
    "NDCG@10000": 1.0
  },
  "map": {
    "MAP@10": 1.0,
    "MAP@100": 1.0,
    "MAP@1000": 1.0,
    "MAP@10000": 1.0
  },
  "recall": {
    "Recall@10": 1.0,
    "Recall@100": 1.0,
    "Recall@1000": 1.0,
    "Recall@10000": 1.0
  },
  "precision": {
    "P@10": 0.2,
    "P@100": 0.02,
    "P@1000": 0.002,
    "P@10000": 0.0002
  },
  "delta": 0.30008,
  "instruction": "expand",
  "query": "What is the title of the memoir written by the honoree of the Black and White Ball?",
  "query_id": "5adbd70c55429947ff173843",
  "generator_model": "ollama_chat/gemma2:9b-instruct-q8_0",
  "temperature": 1.0,
  "dataset": "hotpotqa",
  "cleaned_augmented_query": "biography washington post journalism katharine graham female leadership",
  "final_delta": 0.30008,
  "initial_results": "### Text snippet from document at k=1\n: The Black and White Ball was a masquerade ball held on November 28, 1966 at the Plaza Hotel in New York City. Hosted by author Truman Capote, the ball was in honor of \"The Washington Post\" publisher Katharine Graham.\n\n### Text snippet from document at k=2\n: What I Know For Sure: My Story of Growing Up in America is a best-selling memoir by African-American journalist Tavis Smiley and co-written with David Ritz. The authors published it through Doubleday on October 10, 2006.\n\n### Text snippet from document at k=10\n: The Jewel Ball is the main annual debutante ball held in Kansas City, Missouri, in the United States. It is organized by the Jewel Ball Foundation, which appoints a prominent Kansas City socialite to be the chairwoman.\n",
  "thought_process": "Looking at the original query, \"What is the title of the memoir written by the honoree of the Black and White Ball?\"... this makes me think of Katharine Graham, though the user might actually be trying to understand more about her life and experiences, not just the title of a memoir. The initial results show a mix of relevant and irrelevant information, including details about the Black and White Ball itself and unrelated books.\n\nAnalyzing the results, I notice that terms like \"the,\" \"title of,\" and \"written by\" are too broad and don't add much specificity to the search. They're not helping to narrow down the results to what we're really looking for: a memoir related to Katharine Graham's experience at the Black and White Ball. The task outcomes provided have already identified some key terms and concepts, such as \"biography,\" \"Washington Post,\" \"journalism,\" \"Katharine Graham,\" and \"female leadership,\" which seem to be on the right track.\n\nTo expand on this query effectively, I'll use a structured approach, specifically focusing on techniques like synonym replacement, conceptual expansion, and domain-specific terminology. Given the guidelines, my first step is to elucidate the query's goals and identify gaps. The primary objective is to find a memoir, specifically one written by Katharine Graham related to her experience at the Black and White Ball. A gap in the current query is its lack of specificity regarding the memoir's content or Graham's role at the event.\n\nNext, I identify ineffective terms that should be avoided. As mentioned, terms like \"the,\" \"title of,\" and \"written by\" are too generic and don't contribute much to the search. For breadth expansion, I consider terms that introduce new dimensions but remain relevant, such as \"biography,\" \"memoirs about society events,\" \"journalism history,\" \"Washington D.C.,\" and \"1960s New York City.\" These terms help to broaden the search without losing focus on the core topics of memoirs, journalism, and the specific historical and geographical context.\n\nFor depth expansion, I choose to delve deeper into the topic of \"journalism\" and its related terms, given Katharine Graham's significant role in the field as the publisher of The Washington Post. This leads me to consider terms like \"news publishing,\" \"media mogul,\" \"female leadership,\" and the specific context of \"Washington D.C.\" and \"1960s New York City,\" which are directly related to Graham's life and career.\n\nAs I apply these expansion techniques, I'm also considering how they naturally connect to the original query's intent. The use of \"biography\" and \"journalism\" directly relates to Katharine Graham's profession and the context in which she was honored at the Black and White Ball. The inclusion of \"female leadership\" adds a layer of depth, considering Graham's pioneering role in a male-dominated industry.\n\nThrough this process, insights emerge from both the structured approach and natural intuition. Applying the expansion techniques leads to the discovery of relevant terms like \"biography\" and \"journalism,\" which are directly connected to the query's objectives. My intuition also suggests that terms like \"female leadership\" and \"media mogul\" could provide valuable context, given Graham's significance in these areas.\n\nSynthesizing these insights with clarity, I believe the augmented query should focus on terms that capture the essence of Katharine Graham's career, her experience at the Black and White Ball, and the broader context of journalism and leadership. The final augmented query, \"biography Washington Post journalism Katharine Graham female leadership,\" effectively balances specificity with diversity, ensuring that the search results will be relevant and non-overlapping with the original query.\n\nThis thought process reflects a blend of structured technique and natural cognitive patterns, demonstrating how an expert might approach query expansion by balancing systematic steps with intuitive connections and insights.",
  "thought_generator": "openrouter/meta-llama/llama-3.3-70b-instruct"
}