{
  "reasoning": "The query seeks information about an American folklore creature that gained notoriety in 1964. While the top result correctly identifies the \"Dewey Lake Monster\" (an alias for Bigfoot), the weaknesses highlight a need to refine the search by focusing on cryptids and their public recognition events.",
  "query_goals": [
    "identify american folklore creatures",
    "find cryptids known for notoriety",
    "discover 1964 events related to cryptids"
  ],
  "ineffective_terms": [
    "creature"
  ],
  "breadth_expansion": [
    "cryptids",
    "monsters",
    "legend",
    "mythology",
    "folklore",
    "paranormal",
    "sightings",
    "evidence",
    "public awareness",
    "media attention"
  ],
  "depth_chain": [
    "Bigfoot",
    "Sasquatch",
    "Pacific Northwest",
    "wildlife sightings",
    "footprints",
    "hair samples",
    "forest encounters"
  ],
  "augmented_query": "Bigfoot Sasquatch Pacific Northwest footprints hair samples forest encounters",
  "ndcg": {
    "NDCG@10": 1.0,
    "NDCG@100": 1.0,
    "NDCG@1000": 1.0,
    "NDCG@10000": 1.0
  },
  "map": {
    "MAP@10": 1.0,
    "MAP@100": 1.0,
    "MAP@1000": 1.0,
    "MAP@10000": 1.0
  },
  "recall": {
    "Recall@10": 1.0,
    "Recall@100": 1.0,
    "Recall@1000": 1.0,
    "Recall@10000": 1.0
  },
  "precision": {
    "P@10": 0.2,
    "P@100": 0.02,
    "P@1000": 0.002,
    "P@10000": 0.0002
  },
  "delta": 0.16845,
  "instruction": "expand",
  "query": "What creature of American folklore gained notoriety in 1964?",
  "query_id": "5ae4d3a55542990ba0bbb164",
  "generator_model": "ollama_chat/gemma2:9b-instruct-q8_0",
  "temperature": 1.0,
  "dataset": "hotpotqa",
  "cleaned_augmented_query": "bigfoot sasquatch pacific northwest footprints hair samples forest encounters",
  "final_delta": 0.16845,
  "initial_results": "### Text snippet from document at k=1\n: The Dewey Lake Monster is the name given to a large bipedal creature approximately 10 feet (3 meters) tall and weighing about 500 pounds (227 kilograms), which first gained wide notoriety in June 1964 after several reported sightings near Dewey Lake in Dowagiac, Michigan. It is also referred to as the Michigan Bigfoot and Sister Lakes Sasquatch.\n\n### Text snippet from document at k=2\n: Sasquatch is another name for Bigfoot, an ape-like creature of North American folklore.\n\n### Text snippet from document at k=10\n: The letiche is a creature in Cajun folklore in Louisiana, United States, which haunts the bayous (swamps). It is variously described as the soul of an illegitimate unbaptized infant or a human child raised by alligators. The letiche is said to lurk in the bayous and upset boats and attack travelers.\n",
  "thought_process": "Looking at the original query, \"What creature of American folklore gained notoriety in 1964?\"... this makes me think of mythical beings that have captured the public's imagination. Though the user might actually be trying to find a specific creature, the year 1964 seems to be a crucial piece of information. Hmm, not sure yet what kind of creature this could be, but I'm inclined to think of Bigfoot or the Loch Ness Monster, given their popularity in folklore.\n\nAnalyzing the results of the original query, I notice that the top result correctly identifies the \"Dewey Lake Monster\" as an alias for Bigfoot, which gained notoriety in 1964. However, the weaknesses highlight a need to refine the search by focusing on cryptids and their public recognition events. This tells me that the original query might be too broad and that we need to drill down into more specific terms related to cryptids and their interactions with the public.\n\nTransitioning to a more structured approach, I'll use the expansion technique to systematically enhance the query. This involves identifying ineffective terms, expanding the query breadth, and then deepening it with more specific terms. The technique emphasizes being specific and diverse, applying varied augmentation techniques such as synonym replacement, conceptual expansion, contextual expansion, and domain-specific terminology.\n\nStarting with goal elucidation and gaps, I understand that the primary objective is to identify an American folklore creature that gained notoriety in 1964. The gaps in the original query seem to revolve around its broadness and lack of specificity regarding cryptids and their public recognition.\n\nMoving on to ineffective term identification, I notice that the term \"creature\" is quite broad and non-precise. It's a term that should be avoided in the augmented query to ensure specificity and diversity.\n\nFor breadth expansion, I've identified candidate terms that introduce new dimensions to the query, such as cryptids, monsters, legend, mythology, folklore, paranormal, sightings, evidence, public awareness, and media attention. These terms are aimed at capturing the essence of American folklore creatures and their interactions with the public.\n\nDepth expansion involves choosing a distant but important topic from the breadth expansion and going deeper into related terms. I've chosen Bigfoot as the focal point, given its relevance to the original query and notoriety in 1964. Delving deeper, I've identified terms such as Pacific Northwest, wildlife sightings, footprints, hair samples, and forest encounters. These terms are highly relevant to Bigfoot and provide a more targeted approach to the query.\n\nAs I apply the expansion technique, I notice that the terms are becoming increasingly specific and diverse. The systematic approach is helping to uncover new dimensions to the query that might not have been immediately apparent. However, I'm also allowing for natural cognitive elements to influence the process, such as occasional reconsiderations and intuitive connections that complement the technique.\n\nReconsidering the original query and the expanded terms, I realize that the final augmented query should contain high-quality search terms that are unique, diverse, and relevant to the original query. The terms \"Bigfoot,\" \"Sasquatch,\" \"Pacific Northwest,\" \"footprints,\" \"hair samples,\" and \"forest encounters\" seem to capture both the explicit and implicit aspects of what the user is seeking.\n\nThrough this process of applying the expansion technique and exploring related threads, I believe the augmented query has emerged logically from both the technique and natural insights. The final terms are targeted, precise, and omit any ineffective words or terms, ensuring a refined search that should yield more specific and relevant results.",
  "thought_generator": "openrouter/meta-llama/llama-3.3-70b-instruct"
}