{
  "reasoning": "The query aims to understand the extent of human influence on global climate change. It seeks evidence-based arguments and potential consequences related to this issue. However, it might lack a nuanced exploration of diverse perspectives and economic/political complexities.",
  "query_goals": [
    "identify human impact",
    "analyze scientific evidence",
    "evaluate potential consequences",
    "explore diverse perspectives"
  ],
  "ineffective_terms": [
    "primarily",
    "global",
    "change"
  ],
  "breadth_expansion": [
    "fossil fuels",
    "greenhouse gases",
    "carbon emissions",
    "pollution",
    "deforestation",
    "agriculture",
    "industrialization",
    "consumption patterns",
    "renewable energy"
  ],
  "depth_chain": [
    "carbon footprint",
    "emissions reduction",
    "sustainable practices",
    "environmental policies",
    "climate mitigation strategies",
    "adaptation measures",
    "geoengineering",
    "international agreements"
  ],
  "augmented_query": "fossil fuels greenhouse gases carbon emissions pollution deforestation agriculture industrialization renewable energy emissions reduction sustainable practices climate mitigation strategies adaptation measures",
  "ndcg": {
    "NDCG@10": 1.0,
    "NDCG@100": 0.87275,
    "NDCG@1000": 0.9249,
    "NDCG@10000": 0.9249
  },
  "map": {
    "MAP@10": 0.43478,
    "MAP@100": 0.72281,
    "MAP@1000": 0.74098,
    "MAP@10000": 0.74098
  },
  "recall": {
    "Recall@10": 0.43478,
    "Recall@100": 0.86957,
    "Recall@1000": 1.0,
    "Recall@10000": 1.0
  },
  "precision": {
    "P@10": 1.0,
    "P@100": 0.2,
    "P@1000": 0.023,
    "P@10000": 0.0023
  },
  "delta": 0.017100000000000004,
  "instruction": "expand",
  "query": "Is human activity primarily responsible for global climate change?",
  "query_id": "21",
  "dataset": "touche2020",
  "generator_model": "ollama_chat/gemma2:9b-instruct-q8_0",
  "temperature": 1.0,
  "thought_process": "Looking at the original query, \"Is human activity primarily responsible for global climate change?\"... this makes me think of the complexities involved in understanding the relationship between human actions and climate change. Though the user might actually be trying to understand the extent of human influence, I notice the query lacks a nuanced exploration of diverse perspectives and economic/political complexities. My initial impression is that we need to delve deeper into specific aspects of human activity and their impact on the environment.\n\nI'm seeing several possibilities here... Let me approach this using the expansion technique provided, which involves being specific and diverse, applying varied augmentation techniques, and following a structured task approach. This should help because it allows us to systematically identify gaps, ineffective terms, and then expand both the breadth and depth of the query in a targeted manner.\n\nStarting with Task 1, Goal Elucidation & Gaps, I realize the primary objectives are to identify human impact, analyze scientific evidence, evaluate potential consequences, and explore diverse perspectives. The gaps include a lack of specificity in terms and a narrow focus that might not capture the full complexity of the issue.\n\nMoving to Task 2, Ineffective Term Identification, terms like \"primarily,\" \"global,\" and \"change\" are too broad and do not contribute much to the specificity of the search. These terms should be avoided in the expansion to ensure we're targeting relevant and precise information.\n\nFor Task 3, Breadth Expansion, I've identified terms such as \"fossil fuels,\" \"greenhouse gases,\" \"carbon emissions,\" \"pollution,\" \"deforestation,\" \"agriculture,\" \"industrialization,\" \"consumption patterns,\" and \"renewable energy.\" These terms expand the query by introducing new dimensions related to human activity and its environmental impact.\n\nIn Task 4, Depth Expansion, choosing \"carbon emissions\" as a distant but important topic, I can delve deeper into related terms such as \"emissions reduction,\" \"sustainable practices,\" \"environmental policies,\" \"climate mitigation strategies,\" \"adaptation measures,\" and \"geoengineering.\" This depth expansion provides a richer understanding of the specific aspects of human activity that contribute to climate change and potential solutions.\n\nApplying the expansion technique systematically, I consider how each step reveals new insights. For instance, focusing on \"carbon emissions\" leads to exploring \"emissions reduction\" and \"sustainable practices,\" which are crucial for mitigating climate change. This step of the technique is revealing the importance of policy and technological innovations in reducing emissions.\n\nOccasionally, I step back to reassess and notice that terms like \"renewable energy\" and \"industrialization\" offer a broad perspective on how human activities can both harm and help the environment. My instinct says we should also consider the economic and political factors influencing these activities, such as \"international agreements\" and \"climate mitigation strategies.\"\n\nThrough this process of applying the expansion technique and exploring related threads, I believe the terms from the depth expansion, complemented by high-relevance terms from the breadth expansion, would be most effective for capturing the nuances of the original query. The augmented query should include terms that reflect the complexity of human influence on climate change, the importance of reducing emissions, adopting sustainable practices, and the role of policies and technologies in mitigation and adaptation efforts.",
  "though_generator": "openrouter/meta-llama/llama-3.3-70b-instruct"
}