{
  "reasoning": "The task is to expand on the original query \"Novel DC-DC Multilevel Boost Converter\" by mapping its conceptual territory. The current search results emphasize multilevel converters broadly, often focusing on inverters and general power conversion technologies rather than specifically addressing novel boost converter designs for DC-DC applications. To effectively augment this query, we need to explore the technical aspects more closely associated with the topic while identifying key concepts and terms that may bridge existing gaps in the current search results.\n\nThe central coordinates are identified by pinpointing specific concepts within DC-DC multilevel converters, such as topology innovation and control techniques directly relevant to boost conversion. Establishing these focal points helps us set a practical scale for our exploration between theoretical groundwork and applied engineering practices. To chart the boundaries of this territory, we consider closely related areas in power electronics, such as converter efficiency and voltage regulation strategies. Recognizing neighboring domains like advanced semiconductor materials or energy storage solutions provides context and potentially overlapping areas.\n\nLandmark identification involves plotting essential topics that define advancements within multilevel boost converters, including specific topologies (e.g., cascaded H-bridge), control methodologies, and performance optimization techniques. These landmarks serve as critical resources or knowledge hubs in the research landscape. Detail mapping goes deeper into specialized aspects such as novel semiconductor technologies, innovative control algorithms, and integration with renewable energy systems.\n\nFinally, creating a cartographic legend involves identifying key terms that encapsulate essential concepts and facilitate navigation through this conceptual space. Such terms should help bridge current results by guiding researchers toward more specific areas of interest relevant to the query's focus on novel designs for DC-DC multilevel boost converters.",
  "central_coordinates": [
    "DC-DC Boost Converter",
    "Multilevel Topologies",
    "Control Techniques"
  ],
  "boundary_areas": [
    "Power Electronics",
    "Converter Efficiency",
    "Voltage Regulation",
    "Semiconductor Technology",
    "Energy Storage Integration"
  ],
  "key_landmarks": [
    "Cascaded H-Bridge Topology",
    "Advanced Control Algorithms",
    "Performance Optimization",
    "High-Frequency Operation",
    "Modular Design Approaches"
  ],
  "detail_features": [
    "Novel Semiconductor Devices",
    "Innovative Modulation Techniques",
    "Integration with Renewable Energy Systems",
    "Thermal Management Solutions",
    "Fault-Tolerant Designs"
  ],
  "navigation_terms": [
    "DC-Link Capacitor Minimization",
    "Neutral Point Clamped Converters",
    "Digital Control Methods",
    "Soft-Switching Techniques",
    "Grid-Tied Applications",
    "Energy Harvesting Technologies"
  ],
  "augmented_query": "\"Novel DC-DC Multilevel Boost Converter: Exploring advanced control techniques, multilevel topologies like cascaded H-bridge and NPC, high-frequency operation, modular design approaches, and integration with renewable energy systems.\"",
  "ndcg": {
    "NDCG@10": 0.86879,
    "NDCG@100": 0.95177,
    "NDCG@1000": 0.95177,
    "NDCG@10000": 0.95177
  },
  "map": {
    "MAP@10": 0.8,
    "MAP@100": 0.8625,
    "MAP@1000": 0.8625,
    "MAP@10000": 0.8625
  },
  "recall": {
    "Recall@10": 0.8,
    "Recall@100": 1.0,
    "Recall@1000": 1.0,
    "Recall@10000": 1.0
  },
  "precision": {
    "P@10": 0.4,
    "P@100": 0.05,
    "P@1000": 0.005,
    "P@10000": 0.0005
  },
  "delta": 0.056050000000000044,
  "instruction": "cartography",
  "query": "Novel DC-DC Multilevel Boost Converter",
  "query_id": "d212691257354c201a32729b997ede447e498640",
  "dataset": "scidocs",
  "thought_process": "Looking at the original query \"Novel DC-DC Multilevel Boost Converter,\" this makes me think of advanced power conversion technologies, though the user might actually be trying to explore specific innovations in boost converter designs for DC-DC applications. Hmm, not sure yet... The term \"multilevel\" stands out, suggesting a focus on converters that can operate at multiple voltage levels, which is crucial for efficient power conversion. However, the current search results seem to be broadly focused on multilevel converters, including inverters, rather than specifically on novel boost converter designs.\n\nTo dive deeper, I'm seeing several possibilities here, including exploring different topologies like the cascaded H-bridge or neutral point clamped (NPC) converters, which are known for their efficiency and flexibility in multilevel operations. Let me approach this using the Conceptual Territory Mapping technique, which involves creating a detailed map of the knowledge landscape surrounding the topic. This should help because it allows for a structured exploration of the query's conceptual territory, identifying key concepts, boundary areas, landmarks, and detailed features within the topic.\n\nFollowing the Conceptual Territory Mapping approach, I first identify the central coordinates: DC-DC Boost Converter, Multilevel Topologies, and Control Techniques. These serve as the core concepts around which our exploration will revolve. Next, I chart the boundary areas, which include Power Electronics, Converter Efficiency, Voltage Regulation, Semiconductor Technology, and Energy Storage Integration. Recognizing these neighboring domains provides a broader context and helps in understanding where the query's territory overlaps or connects with other areas.\n\nNow, let's identify the landmarks within this territory. Essential topics or landmarks include Cascaded H-Bridge Topology, Advanced Control Algorithms, Performance Optimization, High-Frequency Operation, and Modular Design Approaches. These landmarks are critical as they define the advancements and key areas of focus within multilevel boost converters. \n\nDetail mapping involves delving into specialized aspects such as Novel Semiconductor Devices, Innovative Modulation Techniques, Integration with Renewable Energy Systems, Thermal Management Solutions, and Fault-Tolerant Designs. These detailed features enrich our understanding of the query's conceptual territory, offering insights into the latest developments and challenges within the field.\n\nAs I navigate through this conceptual map, I notice the importance of balancing theoretical groundwork with applied engineering practices. For instance, understanding the theoretical benefits of multilevel topologies must be complemented with knowledge of how these topologies are controlled and optimized in real-world applications. This balance is crucial for identifying truly novel and practical boost converter designs.\n\nThe process of creating a cartographic legend involves selecting key terms that encapsulate essential concepts and facilitate navigation through this conceptual space. Terms like DC-Link Capacitor Minimization, Neutral Point Clamped Converters, Digital Control Methods, Soft-Switching Techniques, Grid-Tied Applications, and Energy Harvesting Technologies emerge as significant. These terms not only help in bridging current results by guiding researchers toward more specific areas of interest but also highlight the interdisciplinary nature of the query, intersecting with areas like renewable energy and advanced materials.\n\nApplying the Conceptual Territory Mapping technique leads me to realize the complexity and richness of the topic. It's not just about novel designs; it's about how these designs integrate with broader technological and societal trends. I just had a realization that connects to what we were exploring earlier - the potential for multilevel boost converters to play a critical role in renewable energy systems, particularly in grid-tied applications or energy harvesting technologies. This connection underscores the importance of considering not just the technical aspects of converter design but also their application and impact on larger energy systems.\n\nThrough this process of applying Conceptual Territory Mapping and exploring related threads, I believe the terms identified in the cartographic legend would be most effective for navigating the query's conceptual territory. They capture both the explicit and implicit aspects of what the user is seeking - novel, efficient, and practically viable DC-DC multilevel boost converter designs that can contribute meaningfully to the advancement of power electronics and renewable energy integration.\n\nThe final step is synthesizing our findings into a coherent and actionable query that reflects the depths of our exploration. By considering the central coordinates, boundary areas, landmarks, detailed features, and navigation terms, we can construct an augmented query that effectively targets the user's interests and needs.",
  "though_generator": "openrouter/meta-llama/llama-3.3-70b-instruct"
}