{
  "reasoning": "The query centers on the role of TCR/CD3 microdomains in inducing T cell activation through the immunological synapse.  We need to map this concept by understanding its core components (TCR, CD3, synapse formation, signal transduction) and their relationships within the broader context of T cell immunology.",
  "central_coordinates": [
    "TCR/CD3 Microdomains",
    "Immunological Synapse",
    "T Cell Activation"
  ],
  "boundary_areas": [
    "Signal Transduction Pathways",
    "Lipid Rafts",
    "MHC-peptide Complex Recognition",
    "Co-stimulatory Molecules",
    "T Cell Differentiation"
  ],
  "key_landmarks": [
    "TCR/CD3 Complex",
    "Lck Kinase",
    "PI3K Pathway",
    "MAPK Pathway",
    "NFAT Transcription Factor",
    "Cytoskeletal Rearrangement",
    "APC (Antigen Presenting Cell)"
  ],
  "detail_features": [
    "Lipid Bilayer Clustering",
    "Synaptic Polarization",
    "Signal Amplification",
    "Co-localization of Signaling Proteins",
    "Kinetic Engagement Model",
    "TCR Affinity Tuning"
  ],
  "navigation_terms": [
    "Immunological Synapse",
    "T Cell Receptor (TCR)",
    "CD3 Complex",
    "Signal Transduction",
    "Activation Threshold",
    "Antigen Recognition",
    "Immune Response"
  ],
  "augmented_query": "TCR/CD3 microdomains AND signal transduction pathways AND immunological synapse formation AND T cell activation",
  "ndcg": {
    "NDCG@10": 0.2372,
    "NDCG@100": 0.3872,
    "NDCG@1000": 0.3872,
    "NDCG@10000": 0.3872
  },
  "map": {
    "MAP@10": 0.1,
    "MAP@100": 0.1625,
    "MAP@1000": 0.1625,
    "MAP@10000": 0.1625
  },
  "recall": {
    "Recall@10": 0.5,
    "Recall@100": 1.0,
    "Recall@1000": 1.0,
    "Recall@10000": 1.0
  },
  "precision": {
    "P@10": 0.1,
    "P@100": 0.02,
    "P@1000": 0.002,
    "P@10000": 0.0002
  },
  "delta": 0.028449999999999975,
  "instruction": "cartography",
  "query": "TCR/CD3 microdomains are a required to induce the immunologic synapse to activate T cells.",
  "query_id": "1132",
  "dataset": "scifact",
  "generator_model": "ollama_chat/gemma2:9b-instruct-q8_0",
  "temperature": 1.0,
  "thought_process": "Looking at the query \"TCR/CD3 microdomains are required to induce the immunologic synapse to activate T cells,\" this makes me think of the intricate processes involved in T cell activation and the crucial role that the immunological synapse plays in this process. Though the user might actually be trying to understand the specific mechanisms by which TCR/CD3 microdomains contribute to the formation of the immunological synapse, it seems they're aiming to grasp the broader context of T cell immunology.\n\nI'm seeing several possibilities here, but let me approach this using the Conceptual Territory Mapping technique, which involves creating a detailed map of the conceptual territory surrounding the topic. This should help because it allows us to systematically identify key concepts, relationships, and boundaries within the subject area.\n\nFollowing the Conceptual Territory Mapping approach, I should first identify the central coordinates of the query. The exact center point seems to be the role of TCR/CD3 microdomains in T cell activation through the immunological synapse. The cardinal directions could include the molecular mechanisms involved, the cellular processes, and the immunological outcomes. Setting the appropriate scale, I think a granular approach would be most beneficial, given the complexity of the immunological synapse and T cell activation processes.\n\nNow, let's chart the boundaries of the query's immediate territory. The neighboring domains include signal transduction pathways, lipid rafts, MHC-peptide complex recognition, co-stimulatory molecules, and T cell differentiation. Noting areas where territories overlap or connect, it's clear that signal transduction pathways are critical for T cell activation and are closely linked to the formation of the immunological synapse.\n\nPlotting major landmarks, we have the TCR/CD3 complex, Lck kinase, PI3K pathway, MAPK pathway, NFAT transcription factor, cytoskeletal rearrangement, and APC (Antigen Presenting Cell). These are essential for understanding how TCR/CD3 microdomains induce the immunological synapse. Identifying settlements, there are communities focused on immunology, cell biology, and molecular biology, each contributing to our understanding of T cell activation.\n\nMoving to detail mapping, within each region, we need to fill in specialized features. For instance, the process of lipid bilayer clustering, synaptic polarization, signal amplification, co-localization of signaling proteins, kinetic engagement model, and TCR affinity tuning are all crucial for comprehending the immunological synapse's function and formation. Labeling with precise terminology and noting historical sites and emerging developments, it's evident that the field is continuously evolving with new discoveries on the molecular mechanisms underlying T cell activation.\n\nFinally, creating a cartographic legend, we need a lexicon of the most important terms, classified by region and significance. Terms like \"immunological synapse,\" \"T cell receptor (TCR),\" \"CD3 complex,\" \"signal transduction,\" \"activation threshold,\" \"antigen recognition,\" and \"immune response\" are key for navigating this knowledge landscape.\n\nThrough this process of applying Conceptual Territory Mapping and exploring related threads, I believe the terms that would be most effective for query expansion include those directly related to the immunological synapse, T cell activation, and the signal transduction pathways involved. The augmented query \"TCR/CD3 microdomains AND signal transduction pathways AND immunological synapse formation AND T cell activation\" seems to capture the essence of the user's inquiry, balancing the structured approach of the technique with the natural cognitive patterns of exploring a complex biological process.",
  "though_generator": "openrouter/meta-llama/llama-3.3-70b-instruct"
}