{
  "reasoning": "The query focuses on a specific anatomical comparison between arterioles and venules.  The current results are too broad, lacking focus on circulatory system anatomy.",
  "query_goals": [
    "compare arterioles and venules",
    "lumen diameter",
    "blood vessels"
  ],
  "ineffective_terms": [
    "larger"
  ],
  "breadth_expansion": [
    "capillaries",
    "vasodilation",
    "vasoconstriction",
    "blood pressure",
    "microcirculation",
    "arterial system",
    "venous system"
  ],
  "depth_chain": [
    "capillaries",
    "endothelial cells",
    "pericytes",
    "basement membrane",
    "vascular permeability",
    "interstitial fluid",
    "tissue perfusion"
  ],
  "augmented_query": "capillaries endothelial cells pericytes basement membrane vascular permeability interstitial fluid tissue perfusion  compare arterioles venules lumen diameter",
  "ndcg": {
    "NDCG@10": 1.0,
    "NDCG@100": 1.0,
    "NDCG@1000": 1.0,
    "NDCG@10000": 1.0
  },
  "map": {
    "MAP@10": 1.0,
    "MAP@100": 1.0,
    "MAP@1000": 1.0,
    "MAP@10000": 1.0
  },
  "recall": {
    "Recall@10": 1.0,
    "Recall@100": 1.0,
    "Recall@1000": 1.0,
    "Recall@10000": 1.0
  },
  "precision": {
    "P@10": 0.1,
    "P@100": 0.01,
    "P@1000": 0.001,
    "P@10000": 0.0001
  },
  "delta": 0.0,
  "instruction": "expand",
  "query": "Arterioles have a larger lumen diameter than venules.",
  "query_id": "128",
  "dataset": "scifact",
  "generator_model": "ollama_chat/gemma2:9b-instruct-q8_0",
  "temperature": 1.0,
  "thought_process": "The user is searching a BM25 index for 'Arterioles have a larger lumen diameter than venules'. I need to uncover optimal search terms to use with that algorithm by determining the intent of their search. The user seems to be looking for a comparison between arterioles and venules, focusing on the anatomical aspect of lumen diameter within the circulatory system. \n\nTo expand this query, I will be playing a mind game that involves several techniques: Synonym Replacement, Conceptual Expansion, Contextual Expansion, and Domain-Specific Terminology. This game is designed to introduce new dimensions to the query while avoiding overlapping with the original terms.\n\nFirst, I need to elucidate the goals and gaps in the original query. The primary objective is to compare arterioles and venules based on their lumen diameter. A gap in the query is its broadness, lacking specific focus on the circulatory system's anatomy.\n\nNext, I identify ineffective terms that should be avoided. The term 'larger' is too broad and does not add much value to the query's specificity. \n\nFor breadth expansion, I consider terms that are increasingly distant but still relevant to the original query. These include capillaries, vasodilation, vasoconstriction, blood pressure, microcirculation, arterial system, and venous system. Among these, capillaries seem like a promising candidate for deeper exploration because they are directly related to both arterioles and venules in the circulatory pathway.\n\nNow, I will apply depth expansion on the concept of capillaries. This involves going deeper into related terms such as endothelial cells, pericytes, basement membrane, vascular permeability, interstitial fluid, and tissue perfusion. These terms provide a more nuanced understanding of the microcirculatory system and how arterioles and venules interact within it.\n\nBy applying these expansion techniques, I aim to create an augmented query that is novel, diverse, and targeted towards uncovering new, relevant documents across various domains related to the circulatory system's anatomy.\n\nTherefore, the optimal BM25 search terms are capillaries endothelial cells pericytes basement membrane vascular permeability interstitial fluid tissue perfusion compare arterioles venules lumen diameter.",
  "though_generator": "openrouter/meta-llama/llama-3.3-70b-instruct"
}