{
  "reasoning": "The query delves into the specific interaction between molecular flexibility, steric hindrance, and the tumor microenvironment.  While existing results touch upon relevant areas like drug resistance and cellular behavior within tumors, they lack a direct focus on the impact of molecular rigidity/flexibility on steric effects in this context. \n\nTherefore, we need to map a conceptual territory that encompasses:\n\n1. **Central Point:** The concept of steric hindrance as it relates to flexible vs. rigid molecules in a tumor microenvironment.\n2. **Cardinal Directions:** Explore the interplay between molecular structure (flexibility), drug delivery and efficacy (therapeutic applications), cellular responses within the tumor microenvironment, and the physical properties of the tumor matrix.",
  "central_coordinates": [
    "Steric Hindrance",
    "Flexible vs. Rigid Molecules",
    "Tumor Microenvironment"
  ],
  "boundary_areas": [
    "Drug Delivery Systems",
    "Cancer Cell Signaling",
    "Tumor Immunology",
    "Biomaterial Properties",
    "Pharmacokinetics"
  ],
  "key_landmarks": [
    "Diffusion Barriers",
    "Cell Membrane Receptors",
    "Extracellular Matrix",
    "Angiogenesis",
    "Nanoparticle Drug Delivery"
  ],
  "detail_features": [
    "Size Exclusion Effects",
    "Conformational Flexibility",
    "Molecular Docking",
    "Target Accessibility",
    "Enhanced Permeability and Retention (EPR) Effect"
  ],
  "navigation_terms": [
    "Steric Hindrance",
    "Tumor Microenvironment",
    "Flexible Molecules",
    "Rigid Molecules",
    "Drug Delivery",
    "Cell Membrane",
    "Extracellular Matrix",
    "Nanoparticles"
  ],
  "augmented_query": "\"impact of molecular flexibility on drug delivery and efficacy in the tumor microenvironment\", \"steric hindrance of flexible vs. rigid molecules by tumor extracellular matrix\"",
  "ndcg": {
    "NDCG@10": 0.0,
    "NDCG@100": 0.15818,
    "NDCG@1000": 0.15818,
    "NDCG@10000": 0.15818
  },
  "map": {
    "MAP@10": 0.0,
    "MAP@100": 0.01266,
    "MAP@1000": 0.01266,
    "MAP@10000": 0.01266
  },
  "recall": {
    "Recall@10": 0.0,
    "Recall@100": 1.0,
    "Recall@1000": 1.0,
    "Recall@10000": 1.0
  },
  "precision": {
    "P@10": 0.0,
    "P@100": 0.01,
    "P@1000": 0.001,
    "P@10000": 0.0001
  },
  "delta": 0.04079999999999999,
  "instruction": "cartography",
  "query": "Flexible molecules experience greater steric hindrance in the tumor microenviroment than rigid molecules.",
  "query_id": "421",
  "dataset": "scifact",
  "generator_model": "ollama_chat/gemma2:9b-instruct-q8_0",
  "temperature": 1.0,
  "thought_process": "Looking at the query \"Flexible molecules experience greater steric hindrance in the tumor microenvironment than rigid molecules,\" this makes me think of how molecules interact with their environment, particularly in the complex setting of a tumor. Though the user might actually be trying to understand how this interaction affects drug delivery and efficacy, I'm not sure yet what specific aspects of molecular flexibility and steric hindrance they're most interested in.\n\nI'm seeing several possibilities here, including the impact of molecular structure on diffusion through the tumor matrix, the role of cell membrane receptors in recognizing and interacting with flexible versus rigid molecules, and how the extracellular matrix might influence the accessibility of target sites for drug molecules. Let me approach this using the Conceptual Territory Mapping technique, which involves creating a detailed map of the concepts and relationships surrounding the query. This should help because it allows us to systematically explore the central point of the query, its boundaries, key landmarks, and detailed features, ultimately leading to a more comprehensive understanding of the topic.\n\nFollowing the Conceptual Territory Mapping approach, I first identify the central coordinates: the concept of steric hindrance as it relates to flexible vs. rigid molecules in a tumor microenvironment. The cardinal directions for exploration include the practical aspects of drug delivery and therapeutic applications, as well as the theoretical considerations of molecular structure and cellular responses within the tumor microenvironment. Setting the appropriate scale for exploration, I recognize that we need to delve into both the broad implications of molecular flexibility on drug efficacy and the granular details of molecular interactions with the tumor matrix.\n\nAs I chart the boundaries of the query's immediate territory, I notice neighboring domains such as drug delivery systems, cancer cell signaling, tumor immunology, biomaterial properties, and pharmacokinetics. These areas overlap or connect with our central query, particularly in how drug delivery systems are affected by the tumor microenvironment and how biomaterial properties influence the design of nanoparticles for drug delivery.\n\nPlotting major landmarks, I identify key concepts like diffusion barriers, cell membrane receptors, the extracellular matrix, angiogenesis, and nanoparticle drug delivery as crucial for understanding the interaction between molecular flexibility and steric hindrance in the tumor microenvironment. These landmarks suggest \"routes\" or methodologies for further exploration, such as studying the size exclusion effects of the tumor matrix on molecules of different flexibilities or examining the role of conformational flexibility in molecular docking and target accessibility.\n\nFilling in the specialized features within each region, I label them with precise terminology, including terms like enhanced permeability and retention (EPR) effect, which is significant for understanding how nanoparticles can accumulate in tumor tissues. Noting historical sites and emerging developments, I recognize the evolving understanding of the tumor microenvironment and its components, as well as advances in drug delivery technologies that exploit the EPR effect.\n\nCreating a lexicon of the most important terms on our map, I classify them by region and significance. Terms like \"steric hindrance,\" \"tumor microenvironment,\" \"flexible molecules,\" \"rigid molecules,\" \"drug delivery,\" \"cell membrane,\" \"extracellular matrix,\" and \"nanoparticles\" emerge as crucial for navigating this knowledge landscape. These terms will guide the expansion of the query, ensuring that we capture both the explicit and implicit aspects of what the user is seeking.\n\nThrough this process of applying Conceptual Territory Mapping and exploring related threads, I believe the augmented query effectively captures the complexities of molecular flexibility and steric hindrance in the tumor microenvironment. By considering both the structured approach of the technique and the natural cognitive patterns that emerge during exploration, we've synthesized a comprehensive understanding of the topic, ready to be applied in further research or query refinement.",
  "though_generator": "openrouter/meta-llama/llama-3.3-70b-instruct"
}