{
  "reasoning": "The query centers on glycolysis, a fundamental metabolic pathway. While existing results offer valuable insights into its roles in various biological contexts, they lack a comprehensive explanation of the biochemical mechanisms and regulation of glycolysis itself.  Therefore, this knowledge cartography will focus on mapping the conceptual territory surrounding glycolysis, encompassing its molecular underpinnings, regulatory controls, and diverse functional implications across different cellular processes.",
  "central_coordinates": [
    "Glycolytic Pathway",
    "Biochemical Reactions",
    "Cellular Energy Production"
  ],
  "boundary_areas": [
    "Gluconeogenesis",
    "Pentose Phosphate Pathway",
    "Aerobic Respiration",
    "Anaerobic Metabolism",
    "Cancer Metabolism"
  ],
  "key_landmarks": [
    "Hexokinase",
    "Phosphofructokinase",
    "Pyruvate Kinase",
    "Glycogen Synthesis",
    "Lactate Fermentation",
    "Warburg Effect"
  ],
  "detail_features": [
    "ATP production",
    "Substrate-level phosphorylation",
    "Enzyme regulation",
    "Metabolic flux",
    "Insulin signaling",
    "Cancer cell metabolism",
    "Hypoxia response"
  ],
  "navigation_terms": [
    "Glycolysis",
    "Glucose Metabolism",
    "Energy Production",
    "Enzymes",
    "Regulation",
    "Cellular Respiration",
    "Anaerobic Metabolism",
    "Tumorigenesis"
  ],
  "augmented_query": "glycolysis, biochemical mechanisms, regulation, metabolic pathways, cellular energy production, enzyme kinetics, applications in disease",
  "ndcg": {
    "NDCG@10": 0.31546,
    "NDCG@100": 0.31546,
    "NDCG@1000": 0.31546,
    "NDCG@10000": 0.31546
  },
  "map": {
    "MAP@10": 0.125,
    "MAP@100": 0.125,
    "MAP@1000": 0.125,
    "MAP@10000": 0.125
  },
  "recall": {
    "Recall@10": 1.0,
    "Recall@100": 1.0,
    "Recall@1000": 1.0,
    "Recall@10000": 1.0
  },
  "precision": {
    "P@10": 0.1,
    "P@100": 0.01,
    "P@1000": 0.001,
    "P@10000": 0.0001
  },
  "delta": 0.12203000000000003,
  "instruction": "cartography",
  "query": "Glycolysis is one of the primary glycometabolic pathways in cells.",
  "query_id": "475",
  "dataset": "scifact",
  "generator_model": "ollama_chat/gemma2:9b-instruct-q8_0",
  "temperature": 1.0,
  "thought_process": "Looking at the query \"Glycolysis is one of the primary glycometabolic pathways in cells,\" this makes me think of the fundamental processes that cells use to produce energy, though the user might actually be trying to understand the biochemical underpinnings of glycolysis itself. The mention of glycometabolic pathways suggests a broader interest in how cells manage and metabolize glucose, but the query's core seems to revolve around glycolysis.\n\nI'm seeing several possibilities here... Let me approach this using Conceptual Territory Mapping, which involves creating a detailed map of the knowledge landscape surrounding the topic. This should help because it allows us to systematically explore the central concepts, boundary areas, key landmarks, and detailed features related to glycolysis.\n\nFirst, identifying the central coordinates: glycolysis is at the heart, with biochemical reactions and cellular energy production as key aspects. The scale seems to be granular, focusing on the molecular and enzymatic levels. Now, considering the cardinal directions, we have practical applications in disease and theoretical underpinnings in biochemistry.\n\nMoving to boundary exploration, we find gluconeogenesis, the pentose phosphate pathway, aerobic respiration, anaerobic metabolism, and cancer metabolism as neighboring domains. These areas overlap in the context of cellular metabolism and energy production. Noting these connections can help us understand the broader implications of glycolysis.\n\nPlotting major landmarks, we have enzymes like hexokinase, phosphofructokinase, and pyruvate kinase, which are crucial for the glycolytic pathway. Settlements or communities of practice would include biochemists, molecular biologists, and medical researchers focusing on metabolic disorders. The routes or methodologies would involve biochemical assays, enzymatic studies, and metabolic flux analysis.\n\nFilling in the detail features, we look at ATP production, substrate-level phosphorylation, enzyme regulation, metabolic flux, insulin signaling, and the Warburg effect, among others. Labeling these with precise terminology gives us a rich map of the glycolytic pathway's intricacies.\n\nAt this point, creating a cartographic legend involves selecting the most critical terms for navigation: glycolysis, glucose metabolism, energy production, enzymes, regulation, cellular respiration, anaerobic metabolism, and tumorigenesis. These terms would guide someone through the knowledge landscape of glycolysis, touching upon its mechanisms, regulation, and implications in disease.\n\nInterspersing this structured approach with natural thought patterns, I consider how glycolysis connects to broader biological processes. For instance, the regulation of glycolysis by insulin and its dysregulation in diabetes or cancer offers a window into the pathway's significance beyond basic energy production. This reminds me of the pentose phosphate pathway and how it intersects with glycolysis in terms of NADPH production and the potential for generating reactive oxygen species.\n\nFollowing the conceptual territory mapping approach, applying its steps systematically, and allowing for intuitive connections has led to a comprehensive understanding of glycolysis. This process has revealed not just the biochemical mechanisms but also the pathway's role in cellular and disease contexts. The selected navigation terms\u2014glycolysis, biochemical mechanisms, regulation, metabolic pathways, cellular energy production, enzyme kinetics, applications in disease\u2014capture the essence of the query's expanded scope. These terms would be most effective for navigating the knowledge cartography of glycolysis, encompassing both its explicit biochemical aspects and its implicit connections to cellular metabolism and disease.\n\nThrough this process of applying Conceptual Territory Mapping and exploring related threads, I believe these terms emerge logically from both the technique and natural insights, providing a foundation for a deeper exploration of glycolysis and its implications.",
  "though_generator": "openrouter/meta-llama/llama-3.3-70b-instruct"
}