{
  "reasoning": "The original query seeks information on \"poisonous plants,\" but the retrieved documents are primarily about marine biology, foodborne illnesses from fish toxins, and public health concerns related to seafood. The strengths of these documents lie in their detailed analysis of marine biotoxins; however, this is not aligned with the user's interest in terrestrial plant toxicity. To enhance the search query for relevant results, it is essential to refocus on land-based toxic plants rather than marine toxins.",
  "query_goals": [
    "Identify key characteristics and examples of poisonous plants",
    "Understand effects and symptoms of exposure to different plant toxins",
    "Explore geographical distribution of specific poisonous plants",
    "Examine historical or cultural significance of certain toxic plants"
  ],
  "ineffective_terms": [
    "marine",
    "fish",
    "seafood",
    "ocean",
    "waterborne",
    "biotoxins"
  ],
  "breadth_expansion": [
    "toxicology",
    "herbicides",
    "phytotoxins",
    "botanical hazards",
    "land plants",
    "plant safety",
    "wildlife interactions with toxic plants",
    "traditional medicine involving poisonous plants"
  ],
  "depth_chain": [
    "poisonous plant species",
    "aconite",
    "belladonna",
    "hemlock",
    "castor bean",
    "monkshood",
    "foxglove",
    "solanum",
    "cascara sagrada"
  ],
  "augmented_query": "\"toxicology aconite belladonna hemlock castor bean monkshood foxglove solanum cascara_sagrada\"",
  "ndcg": {
    "NDCG@10": 0.0,
    "NDCG@100": 0.0,
    "NDCG@1000": 0.17884,
    "NDCG@10000": 0.17884
  },
  "map": {
    "MAP@10": 0.0,
    "MAP@100": 0.0,
    "MAP@1000": 0.00523,
    "MAP@10000": 0.00523
  },
  "recall": {
    "Recall@10": 0.0,
    "Recall@100": 0.0,
    "Recall@1000": 1.0,
    "Recall@10000": 1.0
  },
  "precision": {
    "P@10": 0.0,
    "P@100": 0.0,
    "P@1000": 0.004,
    "P@10000": 0.0004
  },
  "delta": -0.005730000000000013,
  "instruction": "expand",
  "query": "poisonous plants",
  "query_id": "PLAIN-1887",
  "dataset": "nfcorpus",
  "generator_model": "ollama_chat/phi4:14b-q8_0",
  "temperature": 1.0,
  "thought_process": "Looking at the original query \"poisonous plants,\" this makes me think of various plants that can be harmful to humans or animals, though the user might actually be trying to understand the different types of toxic plants, their effects, and perhaps how to identify them. The initial results, however, seem to be skewed towards marine biology and toxins related to seafood, which doesn't align with the user's interest in terrestrial plant toxicity. \n\nI'm seeing several possibilities here to expand the query effectively. Let me approach this using the technique of query expansion, which involves identifying the primary objectives of the query, recognizing ineffective terms that might be leading to irrelevant results, and then applying breadth and depth expansion techniques to find more relevant terms. This should help because it allows us to systematically explore related concepts and terms that are more directly relevant to the user's interest in poisonous plants.\n\nFollowing the query expansion approach, I should first elucidate the goals and gaps in the original query. The primary objective is to find information on poisonous plants, but there's a gap in that the results are not focused on terrestrial plants. The ineffective terms that should be avoided include \"marine,\" \"fish,\" \"seafood,\" \"ocean,\" \"waterborne,\" and \"biotoxins\" as they steer the search towards marine biology rather than toxicology of land plants.\n\nFor breadth expansion, I consider terms that introduce new dimensions to the query, such as \"toxicology,\" \"herbicides,\" \"phytotoxins,\" \"botanical hazards,\" \"land plants,\" \"plant safety,\" \"wildlife interactions with toxic plants,\" and \"traditional medicine involving poisonous plants.\" These terms help to broaden the search to include various aspects of poisonous plants beyond just their toxic effects.\n\nNext, for depth expansion, I choose a topic like \"poisonous plant species\" and delve deeper into specific examples such as \"aconite,\" \"belladonna,\" \"hemlock,\" \"castor bean,\" \"monkshood,\" \"foxglove,\" \"solanum,\" and \"cascara sagrada.\" This step provides a more detailed and specific set of terms that are directly relevant to the user's query.\n\nAs I apply these expansion techniques, I also consider the importance of avoiding generic terms and focusing on unique, diverse, and relevant terms that do not overlap with the original query. The augmented query should contain high-quality search terms that are targeted and precise, omitting any ineffective words or terms.\n\nThrough this process of applying the query expansion technique and exploring related threads, I believe the terms that would be most effective for enhancing the search query are those that directly relate to toxic land plants, their effects, and specific examples of poisonous plant species. The final augmented query, \"toxicology aconite belladonna hemlock castor bean monkshood foxglove solanum cascara_sagrada,\" captures the essence of the user's interest by focusing on the toxicology of specific land plants, thereby providing a more relevant and targeted search query.",
  "though_generator": "openrouter/meta-llama/llama-3.3-70b-instruct"
}