{
  "reasoning": "To approach the query as a knowledge cartographer, we must first establish the central point and scope of the inquiry. The question of whether standardized tests improve education is multifaceted, requiring consideration of various educational contexts, the purposes of testing, and the impacts on learning. The existing results provide a foundation by offering multiple perspectives and some research evidence, primarily within the US education system. However, to strengthen the inquiry, it's essential to expand the scope to include international perspectives, diverse educational settings, and a balanced view of the arguments for and against standardized testing. This expansion will involve mapping the conceptual territory to identify key landmarks, boundary areas, and detailed features that contribute to the debate on standardized testing and education.",
  "augmented_query": "Do standardized tests improve education outcomes across different socio-economic and cultural contexts, and what are the implications of high-stakes testing on teaching practices and student learning experiences?",
  "ndcg": {
    "NDCG@10": 0.70197,
    "NDCG@100": 0.72674,
    "NDCG@1000": 0.77808,
    "NDCG@10000": 0.81227
  },
  "map": {
    "MAP@10": 0.23406,
    "MAP@100": 0.46956,
    "MAP@1000": 0.48357,
    "MAP@10000": 0.48465
  },
  "recall": {
    "Recall@10": 0.26087,
    "Recall@100": 0.73913,
    "Recall@1000": 0.86957,
    "Recall@10000": 1.0
  },
  "precision": {
    "P@10": 0.6,
    "P@100": 0.17,
    "P@1000": 0.02,
    "P@10000": 0.0023
  },
  "delta": 0.06426,
  "instruction": "cartography",
  "query": "Do standardized tests improve education?",
  "query_id": "26",
  "generator_model": "openrouter/meta-llama/llama-3.3-70b-instruct",
  "temperature": 1.0,
  "dataset": "touche2020",
  "central_coordinates": [
    "Education Quality",
    "Standardized Testing",
    "Learning Outcomes"
  ],
  "boundary_areas": [
    "Educational Policy",
    "Assessment Methods",
    "Teaching Practices",
    "Student Performance",
    "International Education Comparisons"
  ],
  "key_landmarks": [
    "No Child Left Behind Act",
    "Common Core State Standards",
    "SAT and ACT Tests",
    "PISA Rankings",
    "Personalized Learning"
  ],
  "detail_features": [
    "Test Preparation Strategies",
    "Curriculum Alignment",
    "Teacher Training Programs",
    "Technology-Enhanced Assessments",
    "Special Needs Accommodations",
    "Cultural Bias in Testing"
  ],
  "navigation_terms": [
    "Validity",
    "Reliability",
    "Standardization",
    "Accountability",
    "Teaching to the Test",
    "High-Stakes Testing",
    "Formative Assessment",
    "Summative Assessment"
  ],
  "cleaned_augmented_query": "Do standardized tests improve education outcomes across different socio-economic and cultural contexts, and what are the implications of high-stakes testing on teaching practices and student learning experiences?",
  "final_delta": 0.06426,
  "initial_results": "### Text snippet from document at k=1\n... Without standardized testing there would be no form of comparison and equality would not be obtainable. This leads us into our second point. Standardized testing has made tangible the quality of education a school provides, and created accountability in not just teachers and schools, but in districts and states . This has benefited educational mandates in funding in two irreplaceable ways. 1) The implementation of NCLB has enabled schools to sue states for failing to provide standard and adequate teaching facilities. Study conducted by David G. Sciarra, shows direct correlation to how the instatement of No Child Left Behind created accountability to state and government to provide a standard of school safety conditions. The study focuses on, but is not limited to a number of lawsuits in states New Jersey, Ohio, Alabama, Arkansas, New York, Wyoming, Arizona, Idaho, and California where severely underfunded schools that lacked resources, and dew to the passing of the NCLB had the legal grounds to obtaining equil funding and such from the state improving the education of their students. 2) The second way standardized tests have improved education is in actually reforming state legislature dictating funding. Since the 1970\"s, when statewide standardized tests became more common, there was an increase of court cases discussing that different funding was required to support different schools. ...\n\n### Text snippet from document at k=2\n: Closing Argument: In my closing argument I will list some reasons for why standardized testing is an efficient way to reflect the academic value of students. 1. Gardner states \"achievement data from tests provide teachers with valuable information to improve classroom and student learning\". This is yet another quote that supports my claim that the tests to help to improve academics in class rooms. 2. Standardized testing is the best way to know how a student is doing. If schools were to go onto one on one testing it will incredibly time consuming. Also, my opponent said something about a child having problems at home. Believe it or not, a teacher can know if something is wrong from the results of an examination. 4. Standardized tests are also helpful in providing students with the pressure of taking education seriously. Many students want to go to college and they know that in order to get into a respectable college they have to score decent grades in the SAT. This \"pressure\" will cause them to take education seriously and will be beneficial in the long run. Now, I want to leave my opponent and all voters with this quote, \"While there are many purposes that can be served by assessment, they are all secondary to the improvement of student learning.\" Thanks to my opponent for this great debate and I wish all voters will vote Pro. Thank you.\n\n### Text snippet from document at k=10\n... Any bureaucracy created can't be more of a drag on the government or economy than the legion of consultants and think tanks today feeding off the trough of education. This proposal is more in line with what we know about the success of sustainable local organizations and what we know about the inflated rise and inevitable fall of mass reform.\n",
  "thought_process": "Looking at the original query, \"Do standardized tests improve education?\"... this makes me think of the complex interplay between assessment methods, educational policies, and learning outcomes. The user might actually be trying to understand the broader implications of standardized testing on the quality of education, though it's not entirely clear what specific aspects of education they're most interested in. Hmm, not sure yet...\n\nAnalyzing the results of the original query, I notice that the existing reasoning provides a good starting point by introducing the concept of educational contexts and the purposes of testing. However, the initial results seem to focus primarily on the US education system and the role of standardized testing in accountability and funding. This is a good beginning, but I feel that we need to expand the scope to include international perspectives and diverse educational settings to get a more comprehensive understanding of the issue.\n\nNow, let me approach this using the Conceptual Territory Mapping technique, which involves creating a detailed map of the conceptual territory surrounding the topic. This should help because it allows us to systematically explore the central coordinates, boundary areas, landmarks, and detailed features that contribute to the debate on standardized testing and education.\n\nStarting with the central coordinates, I identify education quality, standardized testing, and learning outcomes as the key points of interest. The boundary exploration reveals neighboring domains such as educational policy, assessment methods, teaching practices, student performance, and international education comparisons. Plotting the landmarks, I note significant concepts like the No Child Left Behind Act, Common Core State Standards, SAT and ACT tests, PISA rankings, and personalized learning.\n\nAs I fill in the detailed features, I consider aspects like test preparation strategies, curriculum alignment, teacher training programs, technology-enhanced assessments, special needs accommodations, and cultural bias in testing. Creating a cartographic legend, I extract valuable navigation terms such as validity, reliability, standardization, accountability, teaching to the test, high-stakes testing, formative assessment, and summative assessment.\n\nApplying the Conceptual Territory Mapping technique systematically, I adjust my approach as needed. For instance, I initially thought that standardized testing was primarily about accountability, but exploring the landmarks and detailed features has revealed a more nuanced picture, including the potential benefits of standardized testing in improving education outcomes across different socio-economic and cultural contexts.\n\nOccasionally, I have false starts or reconsiderations. For example, I initially focused on the technical aspects of standardized testing but then realized the importance of considering the social and cultural contexts in which these tests are administered. Intuitive connections also emerge, such as the relationship between personalized learning and the potential for more effective assessment methods.\n\nStepping back to reassess, I see that the insights emerging from both the structured approach and my natural thought patterns are leading me toward a more comprehensive understanding of the issue. Applying the specific aspects of the Conceptual Territory Mapping technique has pointed me toward discoveries like the significance of cultural bias in testing and the potential implications of high-stakes testing on teaching practices and student learning experiences.\n\nThrough this process of applying the Conceptual Territory Mapping technique and exploring related threads, I believe that the terms from the expanded query \u2013 \"Do standardized tests improve education outcomes across different socio-economic and cultural contexts, and what are the implications of high-stakes testing on teaching practices and student learning experiences?\" \u2013 capture both the explicit and implicit aspects of what the user is seeking. These terms would be most effective for a BM25 index as they reflect a nuanced understanding of the complex relationships between standardized testing, education quality, and learning outcomes.",
  "thought_generator": "openrouter/meta-llama/llama-3.3-70b-instruct"
}