{
  "reasoning": "The query seeks a direct translation of Kannada text into another language.  While existing results demonstrate an understanding of translation concepts, they lack the specificity to provide a direct Kannada-to-English/Hindi translation.",
  "query_goals": [
    "Translate Kannada text",
    "Kannada to English translation",
    "Kannada to Hindi translation"
  ],
  "ineffective_terms": [
    "Can someone translate this"
  ],
  "breadth_expansion": [
    "Machine Translation",
    "Language Modeling",
    "Natural Language Processing",
    "Dictionary",
    "Lexicon",
    "Computational Linguistics",
    "Translation Services"
  ],
  "depth_chain": [
    "Machine Translation",
    "Neural Machine Translation",
    "Transformer Models",
    "BERT",
    "Fine-tuning",
    "Pre-trained Language Models",
    "Kannada NLP Resources"
  ],
  "augmented_query": "\"Machine Translation Transformer BERT Kannada English Hindi\"",
  "ndcg": {
    "NDCG@10": 1.0,
    "NDCG@100": 1.0,
    "NDCG@1000": 1.0,
    "NDCG@10000": 1.0
  },
  "map": {
    "MAP@10": 1.0,
    "MAP@100": 1.0,
    "MAP@1000": 1.0,
    "MAP@10000": 1.0
  },
  "recall": {
    "Recall@10": 1.0,
    "Recall@100": 1.0,
    "Recall@1000": 1.0,
    "Recall@10000": 1.0
  },
  "precision": {
    "P@10": 0.1,
    "P@100": 0.01,
    "P@1000": 0.001,
    "P@10000": 0.0001
  },
  "delta": 0.0,
  "instruction": "expand",
  "query": "Can someone translate this Kannada text to English/Hindi?",
  "query_id": "399648",
  "generator_model": "ollama_chat/gemma2:9b-instruct-q8_0",
  "temperature": 1.0,
  "dataset": "quoraretrieval",
  "cleaned_augmented_query": "machine translation transformer bert kannada english hindi",
  "final_delta": 0.0,
  "initial_results": "### Text snippet from document at k=1\n: Could someone translate this Kannada text to English/Hindi?\n\n### Text snippet from document at k=2\n: Can someone translate this image into english?\n\n### Text snippet from document at k=10\n: Can someone translate this video?\n",
  "thought_process": "Looking at the original query, \"Can someone translate this Kannada text to English/Hindi?\" it makes me think of language barriers and the need for accurate translation tools. The user might actually be trying to understand a specific piece of text written in Kannada, but the lack of direct translation services or tools is hindering their progress. The initial results show a mix of translation requests, including images and videos, which, although related, do not precisely match the user's need for text translation.\n\nAnalyzing these results, I notice that while they touch on the concept of translation, they lack the specificity required for translating Kannada text into English or Hindi. The strengths of the current search terms lie in their broad relevance to translation concepts, but their weakness is in not providing direct solutions or services for Kannada-to-English/Hindi translation.\n\nGiven this analysis, I will approach this using the expansion technique, which involves applying specific guidelines to enhance the query. This technique should help because it allows for targeted expansions that introduce new dimensions to the query without overlapping with the original terms. It emphasizes being specific and diverse, applying varied augmentation techniques such as synonym replacement, conceptual expansion, contextual expansion, and domain-specific terminology.\n\nStarting with goal elucidation and gaps, the primary objective is to find a translation service or tool that can translate Kannada text into English or Hindi. The gaps in the current query are its lack of specificity regarding the type of translation needed (machine translation, language modeling, etc.) and the languages involved.\n\nFor ineffective term identification, terms like \"Can someone translate this\" are too broad and non-precise, as they do not specify the language or the type of content (text, image, video) to be translated.\n\nIn breadth expansion, candidate terms could include \"Machine Translation,\" \"Language Modeling,\" \"Natural Language Processing,\" \"Dictionary,\" \"Lexicon,\" \"Computational Linguistics,\" and \"Translation Services.\" These terms expand on the concept of translation but maintain a level of generality that could encompass various types of translation services.\n\nFor depth expansion, focusing on \"Machine Translation\" as a distant but important topic, we can delve deeper into related terms such as \"Neural Machine Translation,\" \"Transformer Models,\" \"BERT,\" \"Fine-tuning,\" \"Pre-trained Language Models,\" and specifically, \"Kannada NLP Resources.\" These terms offer a more targeted approach to the user's query, emphasizing the use of machine learning and neural networks for translation, which is particularly relevant for less commonly translated languages like Kannada.\n\nAs I apply the expansion technique, I notice that the process is revealing insights into how machine translation can be specifically tailored for Kannada-to-English/Hindi translation. The use of transformer models and pre-trained language models like BERT can significantly improve the accuracy of such translations. It also reminds me of the importance of fine-tuning these models on Kannada NLP resources to ensure they can handle the nuances of the Kannada language.\n\nInterspersing this systematic approach with natural thought patterns, I consider how the original query's simplicity belies the complexity of providing accurate translations. The occasional false starts, such as initially considering generic translation services, are corrected as the process focuses more on machine translation and its applications. There are also moments of stepping back to reassess, like realizing the importance of specifying the languages involved (Kannada, English, Hindi) and the type of translation (text).\n\nThrough this process, insights emerge from both the structured approach and intuition. Applying the expansion technique leads to the discovery of specific terms like \"Machine Translation,\" \"Transformer,\" and \"BERT,\" which are directly relevant to improving the translation of Kannada text. My instinct also suggests that including terms related to the languages in question (Kannada, English, Hindi) in the query could enhance its precision.\n\nSynthesizing these insights with clarity, I believe the terms that would be most effective for expanding the query are those that capture the essence of machine translation, particularly for the Kannada language, and its application to text translation into English and Hindi. The final terms should logically emerge from both the technique and natural insights, ensuring they are targeted, diverse, and relevant to the original query without overlapping with the original terms.",
  "thought_generator": "openrouter/meta-llama/llama-3.3-70b-instruct"
}