{
  "reasoning": "The query aims to uncover specific challenges faced by CEOs, going beyond general workplace issues. The current results lack depth and real-world context.",
  "query_goals": [
    "identify unique CEO challenges",
    "explore specific CEO pain points",
    "discover real-world examples of CEO difficulties",
    "gain insights from experienced CEOs"
  ],
  "ineffective_terms": [
    "challenges",
    "biggest"
  ],
  "breadth_expansion": [
    "leadership",
    "strategic planning",
    "market volatility",
    "technology disruption",
    "employee management",
    "corporate culture",
    "risk assessment",
    "financial performance",
    "regulatory compliance"
  ],
  "depth_chain": [
    "leadership",
    "executive decision-making",
    "building high-performing teams",
    "managing change",
    "motivating employees",
    "mentoring and developing talent",
    "succession planning"
  ],
  "augmented_query": "executive decision-making,  high-performing teams,  change management, employee motivation, mentoring, succession planning",
  "ndcg": {
    "NDCG@10": 1.0,
    "NDCG@100": 1.0,
    "NDCG@1000": 1.0,
    "NDCG@10000": 1.0
  },
  "map": {
    "MAP@10": 1.0,
    "MAP@100": 1.0,
    "MAP@1000": 1.0,
    "MAP@10000": 1.0
  },
  "recall": {
    "Recall@10": 1.0,
    "Recall@100": 1.0,
    "Recall@1000": 1.0,
    "Recall@10000": 1.0
  },
  "precision": {
    "P@10": 0.1,
    "P@100": 0.01,
    "P@1000": 0.001,
    "P@10000": 0.0001
  },
  "delta": 0.0,
  "instruction": "expand",
  "query": "What are your biggest challenges as a CEO?",
  "query_id": "415592",
  "generator_model": "ollama_chat/gemma2:9b-instruct-q8_0",
  "temperature": 1.0,
  "dataset": "quoraretrieval",
  "cleaned_augmented_query": "executive decision making high performing teams change management employee motivation mentoring succession planning",
  "final_delta": 0.0,
  "initial_results": "### Text snippet from document at k=1\n: What is the biggest challenge for a CEO?\n\n### Text snippet from document at k=2\n: What is your biggest marketing challenge for 2015?\n\n### Text snippet from document at k=10\n: What are some of your biggest failures?\n",
  "thought_process": "Looking at the original query, \"What are your biggest challenges as a CEO?\"... this makes me think of the various pressures and responsibilities that come with being a CEO, though the user might actually be trying to understand the intricacies of leadership and management. The query seems quite broad, and I'm not sure yet what specific aspects of CEO challenges the user is interested in. \n\nAnalyzing the results of the original query, I notice that they lack depth and real-world context. The text snippets from the initial results, such as \"What is the biggest challenge for a CEO?\" and \"What is your biggest marketing challenge for 2015?\" suggest that the current search terms are too general and might not be capturing the essence of the user's query. I see that terms like \"challenges\" and \"biggest\" are not effective in yielding relevant results, as they are too vague and do not provide a clear direction for the search.\n\nTo approach this query expansion, I'll use a structured technique that involves understanding the primary objectives and gaps in the original query, identifying ineffective terms, expanding the query through breadth and depth expansion, and finally, synthesizing the results to form a cohesive and targeted augmented query. \n\nThe first step is to elucidate the goals and gaps in the original query. Here, the primary objective is to identify unique CEO challenges, explore specific CEO pain points, and discover real-world examples of CEO difficulties. The gaps in the query are the lack of specificity and depth in the current search terms. \n\nNext, I identify ineffective terms that should be avoided. In this case, terms like \"challenges\" and \"biggest\" are too broad and non-precise, and thus, should be replaced with more targeted and specific terms. \n\nFor breadth expansion, I list candidate terms that introduce new dimensions to the query, such as \"leadership,\" \"strategic planning,\" \"market volatility,\" \"technology disruption,\" \"employee management,\" \"corporate culture,\" \"risk assessment,\" \"financial performance,\" and \"regulatory compliance.\" These terms provide a wider scope of potential CEO challenges and help to broaden the search.\n\nThen, for depth expansion, I choose one distant but important topic from the breadth expansion and go deeper into related terms. Here, I select \"leadership\" and expand on it to include terms like \"executive decision-making,\" \"building high-performing teams,\" \"managing change,\" \"motivating employees,\" \"mentoring and developing talent,\" and \"succession planning.\" These terms provide a deeper understanding of the challenges faced by CEOs in the context of leadership.\n\nAs I apply this technique, I also consider my natural thought patterns and intuition. I realize that the terms \"executive decision-making,\" \"high-performing teams,\" \"change management,\" \"employee motivation,\" \"mentoring,\" and \"succession planning\" are not only relevant but also complementary to each other. They capture the essence of CEO challenges in a more nuanced and multi-faceted way. \n\nOccasionally, I reconsider my approach and think about potential false starts or tangents. For instance, I initially thought about including terms related to \"technology disruption,\" but upon further reflection, I realize that while important, they might not be as directly relevant to the core challenges of CEO leadership as the terms I've selected. \n\nStepping back to reassess, I see that the augmented query is taking shape. The terms I've chosen are specific, diverse, and targeted, and they avoid overlapping with the original query terms. They also capture both the explicit and implicit aspects of what the user is seeking. \n\nThrough this process of applying the expansion technique and exploring related threads, I believe the terms \"executive decision making,\" \"high performing teams,\" \"change management,\" \"employee motivation,\" \"mentoring,\" and \"succession planning\" would be most effective for a search query. They provide a rich and nuanced understanding of the challenges faced by CEOs, going beyond the general and vague terms of the original query.",
  "thought_generator": "openrouter/meta-llama/llama-3.3-70b-instruct"
}