{
  "reasoning": "The query seeks a philosophical definition of \"being civilized.\" Current results are too broad, touching on tangential concepts like human nature or historical achievements instead of directly addressing the core meaning.",
  "query_goals": [
    "define",
    "philosophical meaning",
    "civilized behavior",
    "social norms",
    "ethical framework"
  ],
  "ineffective_terms": [
    "meaning"
  ],
  "breadth_expansion": [
    "culture",
    "society",
    "morality",
    "ethics",
    "progress",
    "development",
    "tradition",
    "customs",
    "values",
    "beliefs"
  ],
  "depth_chain": [
    "social norms",
    "cultural practices",
    "ethical codes",
    "moral values",
    "justice system",
    "human rights"
  ],
  "augmented_query": "culture social norms ethical codes moral values justice system human rights",
  "ndcg": {
    "NDCG@10": 1.0,
    "NDCG@100": 1.0,
    "NDCG@1000": 1.0,
    "NDCG@10000": 1.0
  },
  "map": {
    "MAP@10": 1.0,
    "MAP@100": 1.0,
    "MAP@1000": 1.0,
    "MAP@10000": 1.0
  },
  "recall": {
    "Recall@10": 1.0,
    "Recall@100": 1.0,
    "Recall@1000": 1.0,
    "Recall@10000": 1.0
  },
  "precision": {
    "P@10": 0.1,
    "P@100": 0.01,
    "P@1000": 0.001,
    "P@10000": 0.0001
  },
  "delta": 0.0,
  "instruction": "expand",
  "query": "What is the meaning of \"being civilized\"?",
  "query_id": "56198",
  "generator_model": "ollama_chat/gemma2:9b-instruct-q8_0",
  "temperature": 1.0,
  "dataset": "quoraretrieval",
  "cleaned_augmented_query": "culture social norms ethical codes moral values justice system human rights",
  "final_delta": 0.0,
  "initial_results": "### Text snippet from document at k=1\n: What is the meaning of being civilized?\n\n### Text snippet from document at k=2\n: What is the true meaning of being human?\n\n### Text snippet from document at k=10\n: What is being religious?\n",
  "thought_process": "As I begin to explore the query \"What is the meaning of 'being civilized'?\", my initial impressions are that this is a deeply philosophical question. It makes me think of various aspects of human society, culture, and ethics, but the user might actually be trying to understand the core principles that define civilized behavior. I'm not entirely sure yet what specific aspects they're interested in, but it seems like we're on the cusp of delving into a complex discussion about human values and social norms.\n\nLooking at the initial results, I notice that they touch on related but somewhat tangential concepts like human nature or the meaning of being human, rather than directly addressing the definition of \"being civilized\". This tells me that our search terms might be too broad or not precise enough. For instance, the term \"meaning\" is very broad and could apply to almost anything, which might be why we're seeing results that aren't directly related to the concept of civilization.\n\nTo approach this systematically, I'll use the expansion technique provided, which involves being specific, diverse, and applying varied augmentation techniques such as synonym replacement, conceptual expansion, and contextual expansion. This should help because it allows us to explore the query from multiple angles, ensuring we don't miss important aspects of what it means to be civilized.\n\nFirst, let's elucidate the goals and gaps in the original query. The primary objective is to define \"being civilized\" in a philosophical sense, focusing on social norms, ethical frameworks, and possibly cultural practices. A significant gap is the lack of specificity regarding what aspects of civilization the user is interested in\u2014whether it's the historical development, the ethical implications, or the cultural expressions of civilized societies.\n\nThe ineffective terms identified include \"meaning\", as it's too generic and doesn't provide enough context for a focused search on civilization. For breadth expansion, terms like \"culture\", \"society\", \"morality\", \"ethics\", \"progress\", \"development\", \"tradition\", \"customs\", \"values\", and \"beliefs\" come to mind. These terms expand our search to include various dimensions of what could be considered under the umbrella of \"being civilized\".\n\nFor depth expansion, if we take \"social norms\" as our starting point, we can delve deeper into \"cultural practices\", \"ethical codes\", \"moral values\", \"justice system\", and \"human rights\". These terms not only provide a clearer definition of what it means to be civilized but also offer a framework for understanding how civilization operates within societies.\n\nAs I apply these steps, I find that my initial intuitive connections and the systematic approach of the expansion technique complement each other well. The technique helps to ensure that we cover all relevant aspects systematically, while my intuitive insights occasionally point out interesting patterns or potential pitfalls in our search terms. For instance, recognizing that \"social norms\" is a crucial aspect of being civilized led me to consider how ethical codes and moral values are integral to these norms, which in turn are supported by the justice system and respect for human rights.\n\nThrough this process, insights emerge from both the structured technique and natural intuition. Applying the expansion technique leads to the discovery of specific terms like \"ethical codes\" and \"human rights\", which are directly relevant to defining civilized behavior. Meanwhile, my natural thought process occasionally jumps to considerations of how these terms interrelate and impact one another, ensuring a holistic understanding of the query.\n\nSynthesizing all these considerations, I believe the terms that would be most effective for an expanded query, capturing both the explicit and implicit aspects of what the user is seeking, would include \"culture\", \"social norms\", \"ethical codes\", \"moral values\", \"justice system\", and \"human rights\". These terms, derived from a combination of systematic expansion techniques and natural cognitive patterns, provide a comprehensive framework for exploring the meaning of \"being civilized\".",
  "thought_generator": "openrouter/meta-llama/llama-3.3-70b-instruct"
}