{
  "reasoning": "The query seeks to pinpoint the specific county where Odessa, Texas is located. While some results directly answer this, others digress into broader legal or geographical information about Texas. To refine the search, we need to focus on location-specific terms and minimize ambiguity.",
  "query_goals": [
    "Identify the county of Odessa, Texas",
    "Locate Ector County"
  ],
  "ineffective_terms": [
    "lawyer",
    "Odessa, Texas"
  ],
  "breadth_expansion": [
    "West Texas",
    "Texas counties",
    "desert regions",
    "oil production"
  ],
  "depth_chain": [
    "Ector County",
    "midland county",
    "permian basin",
    "oilfield communities",
    "transportation routes"
  ],
  "augmented_query": "Ector County, Midland County, Permian Basin, oilfield",
  "ndcg": {
    "NDCG@10": 1.0,
    "NDCG@100": 1.0,
    "NDCG@1000": 1.0,
    "NDCG@10000": 1.0
  },
  "map": {
    "MAP@10": 1.0,
    "MAP@100": 1.0,
    "MAP@1000": 1.0,
    "MAP@10000": 1.0
  },
  "recall": {
    "Recall@10": 1.0,
    "Recall@100": 1.0,
    "Recall@1000": 1.0,
    "Recall@10000": 1.0
  },
  "precision": {
    "P@10": 0.2,
    "P@100": 0.02,
    "P@1000": 0.002,
    "P@10000": 0.0002
  },
  "delta": 0.0,
  "instruction": "expand",
  "query": "Tryon D. Lewis is a lawyer from Odessa, Texas which is located in what county?",
  "query_id": "5a81d19b55429926c1cdad90",
  "dataset": "hotpotqa",
  "generator_model": "ollama_chat/gemma2:9b-instruct-q8_0",
  "temperature": 1.0,
  "thought_process": "Looking at the original query, \"Tryon D. Lewis is a lawyer from Odessa, Texas which is located in what county?\" this makes me think of geographical locations and how they relate to legal professionals. Though the user might actually be trying to find the county where Odessa, Texas is located, I'm also considering the broader context of why this information is important. It could be for legal purposes, understanding jurisdictions, or simply for educational reasons. The mention of a lawyer adds a professional layer, but it seems the key piece of information needed is the county.\n\nI'm seeing several possibilities here, but to approach this systematically, I'll use the expansion technique provided, which involves being specific and diverse, applying varied augmentation techniques like synonym replacement, conceptual expansion, and focusing on domain-specific terminology. This should help because it allows us to stay focused on the core question\u2014identifying the county\u2014while also exploring related concepts that could provide a more comprehensive understanding or lead to relevant documents.\n\nFirst, let's examine the primary objectives and gaps in the original query. The main goal is to identify the county of Odessa, Texas, and a gap is the lack of direct geographical information. Ineffective terms in this query include \"lawyer\" and \"Odessa, Texas,\" as they are either too broad or do not directly contribute to identifying the county.\n\nFor breadth expansion, considering West Texas, Texas counties, desert regions, and oil production introduces new dimensions. These terms are increasingly distant from the original query but still relevant, especially when considering the geographical and economic context of Odessa.\n\nNow, focusing on depth expansion, choosing Ector County as a distant but important topic allows us to delve deeper. Terms like Midland County, Permian Basin, oilfield communities, and transportation routes provide a richer context. Applying the expansion technique, we replace broad terms with more specific ones, expanding conceptually to understand the region better, and using domain-specific terminology to ensure relevance.\n\nAs I apply these steps, I notice that while \"Ector County\" is directly relevant, terms like \"Permian Basin\" and \"oilfield communities\" offer a deeper insight into the geographical and economic characteristics of the region. This reminds me of the importance of understanding the context in which a location exists, not just its administrative boundaries.\n\nFollowing this process, I've identified key terms that are both specific and diverse, ensuring the augmented query is novel and avoids overlapping with the original terms. The terms \"Ector County,\" \"Midland County,\" \"Permian Basin,\" and \"oilfield\" emerge as high-quality search terms that capture the essence of the query's geographical and contextual needs.\n\nThrough this process of applying the expansion technique and exploring related threads, I believe these terms would be most effective for a targeted search: Ector County, Midland County, Permian Basin, oilfield. They capture both the explicit and implicit aspects of what the user is seeking, providing a balanced approach between structured technique and natural cognitive patterns.",
  "though_generator": "openrouter/meta-llama/llama-3.3-70b-instruct"
}