{
  "reasoning": "The query aims to find the title of a memoir written by Katharine Graham, specifically related to her experience as the honoree at Truman Capote's Black and White Ball.  The current results are too broad, including irrelevant information about other books and music.",
  "query_goals": [
    "find memoir",
    "Katharine Graham",
    "Black and White Ball",
    "Truman Capote"
  ],
  "ineffective_terms": [
    "the",
    "title of",
    "written by"
  ],
  "breadth_expansion": [
    "biography",
    "memoirs about society events",
    "journalism history",
    "Washington D.C.",
    "1960s New York City"
  ],
  "depth_chain": [
    "politics",
    "Washington Post",
    "news publishing",
    "media mogul",
    "female leadership"
  ],
  "augmented_query": "biography Washington Post journalism Katharine Graham female leadership",
  "ndcg": {
    "NDCG@10": 1.0,
    "NDCG@100": 1.0,
    "NDCG@1000": 1.0,
    "NDCG@10000": 1.0
  },
  "map": {
    "MAP@10": 1.0,
    "MAP@100": 1.0,
    "MAP@1000": 1.0,
    "MAP@10000": 1.0
  },
  "recall": {
    "Recall@10": 1.0,
    "Recall@100": 1.0,
    "Recall@1000": 1.0,
    "Recall@10000": 1.0
  },
  "precision": {
    "P@10": 0.2,
    "P@100": 0.02,
    "P@1000": 0.002,
    "P@10000": 0.0002
  },
  "delta": 0.30008,
  "instruction": "expand",
  "query": "What is the title of the memoir written by the honoree of the Black and White Ball?",
  "query_id": "5adbd70c55429947ff173843",
  "dataset": "hotpotqa",
  "generator_model": "ollama_chat/gemma2:9b-instruct-q8_0",
  "temperature": 1.0,
  "thought_process": "Looking at the original query, \"What is the title of the memoir written by the honoree of the Black and White Ball?\"... this makes me think of Katharine Graham, as she was a notable figure associated with such events, though the user might actually be trying to find information on the book itself or the context surrounding the Black and White Ball. The query seems to be touching on elements of biography, memoir, and possibly the intersection of journalism and high society. \n\nI'm seeing several possibilities here... Let me approach this using the expansion technique, which involves understanding the core objectives of the query, identifying ineffective terms, expanding the breadth of related concepts, and then drilling deeper into specific areas of interest. This should help because it systematically breaks down the query into manageable parts and then rebuilds it with more precise and diverse terms.\n\nStarting with goal elucidation, the primary objective is to find a memoir related to Katharine Graham and her connection to the Black and White Ball. There are gaps in the query regarding the specific aspects of Graham's life or the ball that the user is interested in. Ineffective terms that should be avoided include generic words like \"the,\" \"title of,\" and \"written by,\" as they do not add much value to the search query.\n\nFor breadth expansion, considering concepts like biography, memoirs about society events, journalism history, Washington D.C., and 1960s New York City could provide a richer context. These terms start to move away from the generic and towards the specific, incorporating both the personal (Katharine Graham) and the contextual (Black and White Ball, journalism).\n\nNow, focusing on depth expansion, let's choose \"journalism history\" as a topic to delve deeper into. This could include terms like politics, Washington Post (since Katharine Graham was the publisher), news publishing, media mogul, and female leadership. These terms not only provide depth but also start to weave together the various threads of Graham's life and career that might be relevant to the memoir or her experience at the Black and White Ball.\n\nFollowing the expansion technique, I should first identify the most relevant terms from the depth expansion that do not overlap with the original query. Terms like \"biography,\" \"Washington Post,\" \"journalism,\" \"Katharine Graham,\" and \"female leadership\" emerge as strong candidates. They capture both the explicit (Graham's memoir) and implicit (the context of journalism and society) aspects of what the user is seeking.\n\nApplying the specific aspect of the technique leads me to terms like \"media mogul\" and \"news publishing,\" which are directly related to Graham's profession and could be insightful for understanding her memoir. This also reminds me of the broader context of women in leadership positions, especially in the 1960s and 1970s, which could add another layer of depth to the search query.\n\nI just had a realization that connects to what we were exploring earlier; the focus on \"female leadership\" in journalism could be a pivotal aspect of Graham's memoir, especially considering the societal context of her time. Following the technique pointed me toward \"Washington Post\" as a key term, but my instinct says we should also consider the journalistic and societal implications of her work and the Black and White Ball, potentially leading to terms related to social change, media influence, or even the cultural significance of high-society events.\n\nThrough this process of applying the expansion technique and exploring related threads, I believe the terms that would be most effective for an augmented query are those that capture the essence of Katharine Graham's life, her contributions to journalism, and the societal context in which she worked. This leads me to an augmented query that is both specific and diverse, introducing new dimensions to the original query without overlapping with its terms.",
  "though_generator": "openrouter/meta-llama/llama-3.3-70b-instruct"
}