{
  "reasoning": "The query seeks information about an American folklore creature that gained notoriety in 1964. While the top result correctly identifies the \"Dewey Lake Monster\" (an alias for Bigfoot), the weaknesses highlight a need to refine the search by focusing on cryptids and their public recognition events.",
  "query_goals": [
    "identify american folklore creatures",
    "find cryptids known for notoriety",
    "discover 1964 events related to cryptids"
  ],
  "ineffective_terms": [
    "creature"
  ],
  "breadth_expansion": [
    "cryptids",
    "monsters",
    "legend",
    "mythology",
    "folklore",
    "paranormal",
    "sightings",
    "evidence",
    "public awareness",
    "media attention"
  ],
  "depth_chain": [
    "Bigfoot",
    "Sasquatch",
    "Pacific Northwest",
    "wildlife sightings",
    "footprints",
    "hair samples",
    "forest encounters"
  ],
  "augmented_query": "Bigfoot Sasquatch Pacific Northwest footprints hair samples forest encounters",
  "ndcg": {
    "NDCG@10": 1.0,
    "NDCG@100": 1.0,
    "NDCG@1000": 1.0,
    "NDCG@10000": 1.0
  },
  "map": {
    "MAP@10": 1.0,
    "MAP@100": 1.0,
    "MAP@1000": 1.0,
    "MAP@10000": 1.0
  },
  "recall": {
    "Recall@10": 1.0,
    "Recall@100": 1.0,
    "Recall@1000": 1.0,
    "Recall@10000": 1.0
  },
  "precision": {
    "P@10": 0.2,
    "P@100": 0.02,
    "P@1000": 0.002,
    "P@10000": 0.0002
  },
  "delta": 0.16845,
  "instruction": "expand",
  "query": "What creature of American folklore gained notoriety in 1964?",
  "query_id": "5ae4d3a55542990ba0bbb164",
  "dataset": "hotpotqa",
  "generator_model": "ollama_chat/gemma2:9b-instruct-q8_0",
  "temperature": 1.0,
  "thought_process": "Looking at the original query, \"What creature of American folklore gained notoriety in 1964?\"... this makes me think of Bigfoot, though the user might actually be trying to find information on other lesser-known creatures that also gained attention around that time. The connection to 1964 seems pivotal, as it was a significant year for public awareness of certain cryptids. The existing reasoning provided correctly identifies Bigfoot, but there's an opportunity to refine the search further by considering other cryptids and the events that brought them into the spotlight.\n\nI'm seeing several possibilities here... Let me approach this using the expansion technique, which involves being specific and diverse, applying varied augmentation techniques like synonym replacement, conceptual expansion, and domain-specific terminology. This should help because it allows for a broad yet targeted exploration of terms related to American folklore creatures and their notoriety.\n\nThe first step is goal elucidation and gap identification. The primary objective is to identify American folklore creatures that gained notoriety in 1964, with a gap being the lack of specificity regarding the type of creature or the nature of the notoriety. Ineffective terms include \"creature,\" which is too broad and does not add much value to the search.\n\nFor breadth expansion, we consider terms like \"cryptids,\" \"monsters,\" \"legend,\" \"mythology,\" \"folklore,\" \"paranormal,\" \"sightings,\" \"evidence,\" \"public awareness,\" and \"media attention.\" These terms expand our search to include various aspects of how creatures become notorious, from the types of creatures to the ways in which they are perceived and discussed by the public.\n\nFollowing the expansion technique, the next step is depth expansion. Let's focus on Bigfoot, as it's directly related to the query and offers a rich area for deeper exploration. Terms like \"Sasquatch,\" \"Pacific Northwest,\" \"wildlife sightings,\" \"footprints,\" \"hair samples,\" and \"forest encounters\" provide a deeper dive into the specifics of Bigfoot lore and the evidence or encounters that contribute to its notoriety.\n\nAs I apply the technique, I notice that the terms from the depth expansion, particularly those related to Bigfoot, offer a strong foundation for the augmented query. However, to ensure diversity and relevance, we should also consider terms from the breadth expansion that do not overlap with the original query but still capture the essence of American folklore creatures gaining notoriety.\n\nApplying the synonym replacement technique, we might consider \"legendary beings\" or \"mythical entities\" as broader terms that still fit within the context of the search. Conceptual expansion leads us to think about the reasons behind the notoriety, such as \"hoaxes,\" \"investigations,\" or \"documentaries,\" which can provide additional avenues for exploration.\n\nThrough this process of applying the expansion technique and exploring related threads, I believe the terms that would be most effective for the augmented query are those that capture both the specific creature in question and the broader context of notoriety and public interest. Terms like \"Sasquatch,\" \"Pacific Northwest,\" \"wildlife sightings,\" \"footprints,\" \"hair samples,\" \"forest encounters,\" and additional terms like \"legendary,\" \"mythical,\" \"hoaxes,\" and \"investigations\" could enhance the search, making it more targeted and diverse.\n\nHowever, upon reevaluation for the final output, it's crucial to ensure that the selected terms are unique, diverse, and primarily from the depth expansion, with an emphasis on relevance and precision. Thus, focusing on the depth expansion related to Bigfoot and incorporating relevant terms from the breadth expansion that enhance the search without overlapping the original query is key.\n\nThe final consideration involves omitting any ineffective words or terms, even if they were used in the expanded terms, to ensure the augmented query is as precise and effective as possible. This means avoiding broad terms and focusing on those that offer a clear, targeted search strategy.",
  "though_generator": "openrouter/meta-llama/llama-3.3-70b-instruct"
}