{
  "reasoning": "The original query focuses on pinpointing the release date of toddlers in The Sims 4. While one document directly addresses this by providing the specific patch information, other documents are more general and offer context across various versions of The Sims rather than specifics about The Sims 4 toddlers' introduction. This indicates a gap in content around detailed insights into updates or features specific to The Sims 4, as well as historical significance within the game series.\n\nFor Task 1, the goal is clear: ascertain precise information about when toddlers were introduced in The Sims 4. Identifying gaps reveals that while the basic question is addressed, more nuanced details like update impact and feature descriptions are lacking. \n\nTask 2 highlights ineffective terms which do not contribute to narrowing down or adding specificity to this query, such as vague references to life stages without dates.\n\nIn Task 3, breadth expansion involves considering various related but increasingly distant topics that could add dimensions to the user's understanding of The Sims 4 updates.\n\nTask 4 narrows this breadth by selecting one key concept from Task 3 and going deeper into specific expansions relevant to the original query. This helps focus on detailed aspects such as update mechanics, player reception, or feature impact.",
  "query_goals": [
    "Identify the specific release date of toddlers in The Sims 4",
    "Explore updates and patches related to The Sims 4",
    "Provide additional context on how this introduction impacted gameplay"
  ],
  "ineffective_terms": [
    "life stages",
    "The Sims series",
    "The Sims 3"
  ],
  "breadth_expansion": [
    "game updates",
    "patch notes for The Sims 4",
    "new features in gaming patches",
    "impact of toddler feature on gameplay",
    "community reaction to game updates",
    "development insights on The Sims 4 patches"
  ],
  "depth_chain": [
    "Patch notes for The Sims 4",
    "Detailed update mechanics of January 2017 patch",
    "Community feedback and reviews on toddlers introduction",
    "Changes in gameplay dynamics post-toddler feature"
  ],
  "augmented_query": "detailed patch notes January 2017 The Sims 4 community reaction game updates impact toddler feature gameplay dynamics",
  "ndcg": {
    "NDCG@10": 1.0,
    "NDCG@100": 1.0,
    "NDCG@1000": 1.0,
    "NDCG@10000": 1.0
  },
  "map": {
    "MAP@10": 1.0,
    "MAP@100": 1.0,
    "MAP@1000": 1.0,
    "MAP@10000": 1.0
  },
  "recall": {
    "Recall@10": 1.0,
    "Recall@100": 1.0,
    "Recall@1000": 1.0,
    "Recall@10000": 1.0
  },
  "precision": {
    "P@10": 0.2,
    "P@100": 0.02,
    "P@1000": 0.002,
    "P@10000": 0.0002
  },
  "delta": 0.2808,
  "instruction": "expand",
  "query": "when did the sims 4 toddlers come out",
  "query_id": "test598",
  "generator_model": "ollama_chat/phi4:14b-q8_0",
  "temperature": 1.0,
  "dataset": "nq",
  "cleaned_augmented_query": "detailed patch notes january 2017 sims 4 community reaction game updates impact toddler feature gameplay dynamics",
  "final_delta": 0.2808,
  "initial_results": "### Text snippet from document at k=1\n: Seven life stages are available including baby, toddler, child, teenager, young adult, adult and elder. The baby life stage is accessible only through the birth of a Sim and not available in Create A Sim. Toddlers were initially absent from the original game release, but were added in the January 2017 patch.[10][11]\n\n### Text snippet from document at k=2\n: The Sims 2 characters pass through seven life stages \u2014 babies, toddlers, children, teenagers, young adults (only with University), adults, and elders \u2014 with eventual death of old age, while babies in The Sims only become children before ceasing to continue aging. The aspiration system (described above) is also new to The Sims 2. Sims can become pregnant and produce babies that take on genetic characteristics of their parents, such as eye color, hair color, facial structure, and personality traits as opposed to Sims, in which the baby would take on random appearance and personality. Genetics play a major role in the game, and as such, dominant and recessive genes play a larger role than they did in the original game. A player can also aspire to have a Sim abducted by aliens. Males then have the chance to become impregnated and produce after three Sim days a half-alien child.\n\n### Text snippet from document at k=10\n: [T]he movie ... present[ed] audiences with a willful female protagonist that was firmly in control of her romantic destiny and regularly placed reading books above chasing after boys. And it's true that in that respect at least, Belle stood in stark contrast to past Disney heroines ... Still, the filmmakers didn't do the character any favors by swapping out that boy crazy trait for a pronounced maternalistic streak that comes across as a little creepy. Besides being utterly devoted to her father, Belle's relationship with the Beast possesses a distinctly mother/toddler dynamic ... Their romance also lacks spark because \u00e2\u20ac\u201c due to the fundamental set-up of the narrative ... it's always clear that he needs her far more than she needs him. Particularly when compared to some of the dynamic animated heroines that came after her ... today Belle can't help but seem ... bland.\n",
  "thought_process": "Looking at the original query \"when did the sims 4 toddlers come out,\" this makes me think of the life stages in The Sims series and how they've evolved over time. Though the user might actually be trying to understand the specific update or patch that introduced toddlers to The Sims 4, I'm not sure yet what other aspects of this update they might be interested in. The introduction of toddlers could have significant implications for gameplay, from new interactions and family dynamics to changes in how players approach building and managing their Sims' lives.\n\nAnalyzing the results of the original query, I notice that while some documents directly address the release date of toddlers in The Sims 4, others provide more general information about life stages across different versions of The Sims. This indicates a gap in content around detailed insights into updates or features specific to The Sims 4, as well as historical significance within the game series. The ineffective terms like \"life stages\" and references to other versions of The Sims, such as \"The Sims series\" and \"The Sims 3,\" do not contribute much to narrowing down the query to the specifics of The Sims 4 toddlers.\n\nNow, let me approach this using the expansion technique provided, which involves being specific and diverse, applying varied augmentation techniques like synonym replacement, conceptual expansion, contextual expansion, and domain-specific terminology. This should help because it allows for a structured yet flexible approach to query expansion, ensuring that the augmented query is both novel and relevant.\n\nFollowing the technique, I first elucidate the goals and gaps in the original query. The primary objective is to identify the specific release date of toddlers in The Sims 4 and explore related updates and patches. Gaps include detailed information on how this introduction impacted gameplay and the community's reaction.\n\nNext, I identify ineffective terms that should be avoided, such as \"life stages\" and general references to \"The Sims series\" or other versions like \"The Sims 3,\" as they do not contribute to the specificity required for the query about The Sims 4 toddlers.\n\nFor breadth expansion, I consider terms that introduce new dimensions to the query, such as \"game updates,\" \"patch notes for The Sims 4,\" \"new features in gaming patches,\" \"impact of toddler feature on gameplay,\" \"community reaction to game updates,\" and \"development insights on The Sims 4 patches.\" These terms start to build a more comprehensive picture around the introduction of toddlers in The Sims 4.\n\nThen, for depth expansion, I choose one of these topics, such as \"patch notes for The Sims 4,\" and delve deeper into related terms like \"detailed update mechanics of January 2017 patch,\" \"community feedback and reviews on toddlers introduction,\" and \"changes in gameplay dynamics post-toddler feature.\" This depth expansion allows for a more nuanced understanding of the impact and context of the toddlers' introduction.\n\nApplying the technique systematically, I also allow for natural thought patterns to influence the expansion. For instance, considering the update mechanics leads me to think about how the introduction of toddlers might have changed the way players interact with their Sims, which in turn reminds me of the importance of community feedback in game development. This connection highlights the value of including terms related to community reaction and gameplay dynamics in the expanded query.\n\nThrough this process, insights emerge from both the structured approach and natural intuition. Applying the technique leads to the discovery of specific terms like \"detailed patch notes January 2017\" and \"community reaction,\" which are directly relevant to understanding the context and impact of the toddlers' introduction. My intuition also suggests that terms like \"game updates\" and \"impact on gameplay\" are crucial for capturing the broader implications of this update.\n\nSynthesizing these insights with clarity, I believe the terms that would be most effective for expanding the query are those that capture both the explicit and implicit aspects of what the user is seeking. The final augmented query, \"detailed patch notes January 2017 The Sims 4 community reaction game updates impact toddler feature gameplay dynamics,\" reflects a balance between the structured technique and natural thought patterns, ensuring that the expanded query is both novel and relevant.",
  "thought_generator": "openrouter/meta-llama/llama-3.3-70b-instruct"
}