{
  "reasoning": "The query aims to determine whether \"The Nightmare Before Christmas\" was originally produced or planned by Disney. The current search results provide historical context about its association with Tim Burton, Disney's strategic decisions regarding film release channels due to content, and subsequent cultural impacts of the movie. However, some results veer into post-release phenomena rather than focusing directly on production origins.\n\nTo enhance this query, ineffective terms need identification and removal to refine focus. Terms related specifically to broader impacts or unrelated topics should be avoided to avoid distracting from the main goal. Breadth expansion will explore wider concepts like film production companies and industry practices regarding genre-based content distribution. Depth expansion will delve deeper into the relationships between creative teams and specific studio branches, focusing on production origins and decision-making.",
  "query_goals": [
    "Determine if \"The Nightmare Before Christmas\" was initially produced by Disney.",
    "Explore the decision process for its release under a different label.",
    "Understand Disney\u2019s role in film content decisions based on perceived market fit or audience appropriateness."
  ],
  "ineffective_terms": [
    "Touchstone Pictures",
    "Disneyland attractions",
    "gaming content",
    "Tim Burton cultural impact",
    "post-release phenomena"
  ],
  "breadth_expansion": [
    "production companies",
    "film distribution strategies",
    "content rating concerns",
    "studio divisions",
    "animated film genre decisions"
  ],
  "depth_chain": [
    "Touchstone Pictures",
    "studios and sub-labels",
    "Disney animation division",
    "dark-themed content handling in family studios",
    "release strategy for unconventional films"
  ],
  "augmented_query": "'production companies involved with The Nightmare Before Christmas', 'film distribution strategies Disney', 'content rating decisions at Touchstone Pictures', 'studio divisions responsible for animated releases by Disney', 'handling of dark-themed films within major animation studios'",
  "ndcg": {
    "NDCG@10": 1.0,
    "NDCG@100": 1.0,
    "NDCG@1000": 1.0,
    "NDCG@10000": 1.0
  },
  "map": {
    "MAP@10": 1.0,
    "MAP@100": 1.0,
    "MAP@1000": 1.0,
    "MAP@10000": 1.0
  },
  "recall": {
    "Recall@10": 1.0,
    "Recall@100": 1.0,
    "Recall@1000": 1.0,
    "Recall@10000": 1.0
  },
  "precision": {
    "P@10": 0.1,
    "P@100": 0.01,
    "P@1000": 0.001,
    "P@10000": 0.0001
  },
  "delta": 0.0,
  "instruction": "expand",
  "query": "was nightmare before christmas originally a disney movie",
  "query_id": "test1618",
  "generator_model": "ollama_chat/phi4:14b-q8_0",
  "temperature": 1.0,
  "dataset": "nq",
  "cleaned_augmented_query": "production companies involved nightmare christmas film distribution strategies disney content rating decisions touchstone pictures studio divisions responsible animated releases handling dark themed films within major animation studios",
  "final_delta": 0.0,
  "initial_results": "### Text snippet from document at k=1\n: The Nightmare Before Christmas originated in a poem written by Tim Burton in 1982, while he was working as an animator at Walt Disney Feature Animation. With the success of Vincent in the same year, Walt Disney Studios began to consider developing The Nightmare Before Christmas as either a short film or 30-minute television special. Over the years, Burton's thoughts regularly returned to the project, and in 1990, he made a development deal with Disney. Production started in July 1991 in San Francisco; Disney released the film through its Touchstone Pictures banner because the studio believed the film would be \"too dark and scary for kids\".[4]\n\n### Text snippet from document at k=2\n: Jim Edwards contends that \"Tim Burton's animated movie The Nightmare Before Christmas is really a movie about the marketing business. The movie's lead character, Jack Skellington, the chief marketing officer (CMO) for a successful company, decides that his success is boring and he wants the company to have a different business plan.\"[43]\n\n### Text snippet from document at k=10\n: In January 2009, filmmaker Neil Jordan signed on to write and direct a film adaptation to Miramax. In April 2012, Walt Disney Pictures acquired the rights and hired Henry Selick, director of The Nightmare Before Christmas and the film adaptation of Gaiman's novel Coraline, to direct The Graveyard Book.[28] After the studio and Selick parted ways over scheduling and development, it was announced in January 2013 that Ron Howard will direct the film.[29]\n",
  "thought_process": "Looking at the original query, \"was nightmare before christmas originally a disney movie,\" this makes me think of the complexities of film production and distribution. The user might actually be trying to understand the nuances of how Disney handles content that may not fit its traditional family-friendly image. Initially, I'm considering the role of Tim Burton, the poem that started it all, and how Disney's perception of the film's darkness could influence its release strategy.\n\nAnalyzing the results of the original query, I notice that while they provide valuable historical context and insights into Disney's decision-making process, some veer off into post-release phenomena and cultural impacts rather than focusing directly on production origins. This tells me that the original query might be too broad or not specific enough to yield the desired information directly related to the production and initial release considerations.\n\nI'm seeing several possibilities here, but let me approach this using the expansion technique provided, which involves being specific and diverse, applying varied augmentation techniques like synonym replacement, conceptual expansion, contextual expansion, and domain-specific terminology. This should help because it will allow me to systematically explore related concepts and terms that are both novel and relevant to the query.\n\nFirst, I identify ineffective terms that should be avoided, such as \"Touchstone Pictures\" when considering the broader query goals, \"Disneyland attractions,\" \"gaming content,\" \"Tim Burton cultural impact,\" and \"post-release phenomena,\" as these distract from the main goal of understanding the original production and release considerations.\n\nFor breadth expansion, I consider terms that introduce new dimensions to the query, such as \"production companies,\" \"film distribution strategies,\" \"content rating concerns,\" \"studio divisions,\" and \"animated film genre decisions.\" These terms help in understanding the landscape of film production and distribution, especially within the context of a major studio like Disney.\n\nDelving deeper into the depth expansion, I focus on a specific area like \"Touchstone Pictures\" and explore related terms such as \"studios and sub-labels,\" \"Disney animation division,\" \"dark-themed content handling in family studios,\" and \"release strategy for unconventional films.\" This depth chain helps in narrowing down the query to focus on the specific mechanisms and considerations within Disney that led to the decision of releasing \"The Nightmare Before Christmas\" under Touchstone Pictures.\n\nApplying the expansion technique systematically, I also allow for natural thought patterns to emerge. For instance, considering the nature of \"The Nightmare Before Christmas\" as a dark-themed animated film, it reminds me of the importance of content rating decisions and how they influence distribution strategies. This leads me to think about other films or projects that might have faced similar challenges within Disney or other major studios, and how these cases could inform our understanding of the original query.\n\nAs I balance the structured approach with natural cognitive elements, I find that the process is not linear. There are occasional false starts or reconsiderations, like when I initially thought to focus solely on Tim Burton's role, only to realize that understanding the broader studio dynamics and distribution strategies was more critical. There are also intuitive connections that complement the technique, such as recognizing the relevance of content rating concerns to the release of films like \"The Nightmare Before Christmas.\"\n\nThe insights emerging from both the structured approach and intuition are invaluable. Applying the expansion technique leads me to discover terms like \"production companies involved with The Nightmare Before Christmas,\" \"film distribution strategies Disney,\" \"content rating decisions at Touchstone Pictures,\" \"studio divisions responsible for animated releases by Disney,\" and \"handling of dark-themed films within major animation studios.\" These terms not only capture the essence of the original query but also expand it to include relevant aspects that were not initially considered.\n\nThrough this process of applying the expansion technique and exploring related threads, I believe the terms that would be most effective for enhancing the query are those that capture both the explicit and implicit aspects of what the user is seeking. The augmented query, \"production companies involved nightmare christmas film distribution strategies disney content rating decisions touchstone pictures studio divisions responsible animated releases handling dark themed films within major animation studios,\" represents a synthesis of structured technique and natural cognitive patterns, ensuring that the final terms emerge logically from both the methodical expansion and the intuitive insights gained during the process.",
  "thought_generator": "openrouter/meta-llama/llama-3.3-70b-instruct"
}